url,headline,body,source_name,categories,authors,datepub,description,image
https://www.si.com/college/georgia/news/travis-hunter-commits-will-it-be-georgia-football,BREAKING: Travis Hunter Makes Transfer Decision,"A sudden turn of events has led Travis Hunter to announce his decision. Will he join head coach Deion Sanders at Colorado, head home to Georgia, or land elsewhere?
Travis Hunter has announced his college decision in an unthinkable turn of events. It isn't the first time he's owned the news cycle during early national signing day, as last year, he spurned Florida State to sign with Jackson State.
After an impressive freshman season, Hunter entered the transfer portal. Head coach Deion Sanders left for Colorado in search of greater opportunities and will likely bring several Jackson State players along with him.
However, Hunter ensured that everyone knew he wouldn't blindly follow Sanders. He weighed his decision carefully and reportedly was in talks with Georgia and head coach Kirby Smart.
Georgia was the first school to get Hunter on campus while he was committed to Florida State. Hunter hadn't visited any college campus outside of Tallahassee in years, and that time in Athens opened his mind to other possibilities.
Coming out of high school, Hunter was one of the most athletic talents we had seen. He has an NFL future at either wide receiver or corner, and he will have his pick wherever he goes.
He posted two messages to his Twitter profile on Wednesday afternoon, saying that if fans got him to 100,000 subscribers on Youtube, he would announce his commitment.
The public answered the call, and Hunter returned the favor. He announced that he would transfer to Colorado. 
Join the community:
Follow Brooks Austin on Twitter: @BrooksAustinBA
Subscribe to our YouTube Page HERE","Sports Illustrated Georgia Bulldogs News, Analysis and More","Kirby smart, News, Georgia bulldogs, Travis hunter, Deion sanders, Georgia football",Brooks austin,"Thu, 22 Dec 2022 03:59:03 GMT","A sudden turn of events has led Travis Hunter to announce his decision. Will he join head coach Deion Sanders at Colorado, head home to Georgia, or land elsewhere?",https://www.si.com/.image/c_limit%2Ccs_srgb%2Cfl_progressive%2Ch_1200%2Cq_auto:good%2Cw_1200/MTk0NjA2NzEyNzQzNzk4Mjk2/usatsi_19641871.jpg
