url,headline,body,source_name,categories,authors,datepub,description,image
https://www.si.com/college/notredame/football/notre-dame-football-marcus-freeman-talks-nil-impact-on-irish-recruiting-stires,Marcus Freeman Talks NIL And Its Impact On Recruiting At Notre Dame,"Name, image and likeness money played a big part though in other Notre Dame de-commitments. Irish head coach Marcus Freeman discussed it in detail
The dust is settling from what turned out to be one of the more tumultuous signing days in recent memory. When all was said and done Marcus Freeman and Co inked a 24-member class that included 21 four-star football players. The 3.875 star average the group totaled is the second-highest at Notre Dame since 2002 (the Jaylon Smith-led 2013 class averaged 3.913). 
The majority of Freeman’s first full-fledged recruiting class committed to Notre Dame before the 2022 season ever began.  
""It’s important,” Freeman said of the early commitments. ""I think it’s a lot harder to de-commit than it is to commit. We’ve always said that the earlier you can get these guys committed to Notre Dame, I think the better chance you have to signing them. But you’ve got to make sure they understand the value of this place and with time comes other obstacles, right. Other thoughts into these recruits minds and thought process. For them to continue to formulate a bond with each other within this class is so important, because that's ultimately I think one of the most important factors into this decision is the bond they have with the other guys in their class, because that’s never going to change.  
The recent tumult did not come from the 24 commitments, though. The drama came from the ones who de-committed and went elsewhere. Defensive end Keon Keeley, safety Peyton Bowen, quarterback Dante Moore, offensive tackle Elijah Paige, cornerback Justyn Rhett and running back Jayden Limar were all committed to Notre Dame at one point, but they all ended up at different schools.  
""Listen, we’re all competitors,” Freeman said when asked about the disappointment of losing highly rated recruits in the class. ""We want everyone. If we could take 30 kids, 40 kids I’m sure we would, but at the end of the day you have to continue to sell what you believe attracts young people here. They have to make the decision to come to Notre Dame for the right reasons and if it’s not the best place for them we have to be okay with that and really make sure we’re just bringing in the right kids. You can’t worry about the ones you didn’t get. More so, you have to be concerned about the ones that you are bringing in. At the end of the day that’s what’s important. I felt like we brought in the exact guys we needed and we’re extremely happy with this class.” 
This is the second recruiting cycle in which name, image and likeness (NIL) was at play in the recruiting process. Limar chose Oregon. Moore, who de-committed of his silent verbal, first flipped to Oregon then ultimately signed with UCLA. 
Keeley, the crowned jewel of the class, was also an early commit who de-committed in August, ended up at Alabama.  The biggest commotion in the last week came from the ""will he or won’t he stay committed” turned de-commitment from five-star safety Bowen.
The lure of instant NIL cash is believed to have been a major factor in the flips of all four of the talented players.  
""If that’s the only reason they want to come to Notre Dame this ain’t going to be the right fit for them,” Freeman said of the impact of NIL money on recruits. ""I think the more we can get them back to show them what makes Notre Dame important, what makes this place special, the value of this university, the value of this education, the value of playing football here at this place is really what attracts you and what keeps you here. That’s what we all have to understand.  
""If you’re coming here because of NIL, it’s probably not going to be the best place for you and it’s not going to be the place you choose,” Freeman continued. ""If you come here and you understand the value of this university, this network, this football team, then you’ve got a great chance to stick it out when things get really, really tough. Because that’s college. That’s, 18 to 22 it gets tough. There’s bumps in the road and when you choose this place for what it brings you way past the time you’re here, then during those tough times you’ll lean on those teammates that I just talked about, those guys that came in with you, but also you’ll lean on the understanding that hey, the value of Notre Dame is going to take care of you for a long time.  
It’s not enough just to simply evaluate the talent of a player. Freeman and his staff must also now gauge a potential recruit to determine during the recruiting process just how much NIL could be a factor in their college decision. 
""I think every kid you’ve got to look at and say, okay, why did we get him or why didn’t we get him,” Freeman remarked. ""That’s something we’ll do as a staff is say, okay, every recruit that signed here, why did we get him, what was important? The kids that we didn’t get, why didn’t we get him, what was important, what could we have done differently? The ones that de-committed, why did they de-commit, what could we have done differently? And some of them we might have to say, it wasn’t the right fit, it’s okay. Some we’ve got to look and say we’ve got to evaluate the way we’re recruiting, what we’re selling, how we got to the point where they didn’t want to come here or they de-committed.  
""I think if you don’t learn from every kid that’s committed or de-committed, you’re losing a chance to grow and that’s something we’re going to do,” Freeman continued. ""Will NIL be a topic? Absolutely. We have to make sure that no matter what the important things in recruiting, we’ve got to make sure that we’re competitive and NIL is important to some of these recruits and we’ve got to make sure we’re competitive and I think we are. But we’ve got to continue to look back and evaluate who we got, why we got them and why we didn’t get certain guys.” 
The cold hard facts of recruiting in an NIL world is money talks. That means some player will require an up-front dollar amount to sign a letter of intent on the dotted line. 
""We don’t speak to that,” said Freeman. ""Is it a part of recruiting? Yeah, because you discuss it. It’s a topic of discussion. But in terms of acquisition feeds, we’re not going to get into that. We can’t. Because, again, if that’s going to be the reason that you decided to come here, man, it’s hard to keep you here. That’s what I think we all, as coaches and competitors that want who we view sometimes as the best, right, we want the best, we want the highest rated, all these different things, we have to understand it’s still about getting the right guys here. You look at last year’s class, and again that was another top 10 class, I think I looked at it the other day maybe four or five guys played this year, didn’t redshirt. I mean, out of a class that we signed 22 to 25 guys. So, I say that’s important, because if you’re coming here for an acquisition fee, as you said, or you’re coming here for NIL and you don’t get that instant gratification of playing right away, it’s going to be tough, right? Tough to stay here. That’s what we’ve got to understand is when you bring these guys in it’s going to take a little bit of time to really be able to run out there at Notre Dame Stadium and have a huge impact on our program. It takes time. Very few guys can come in here and play and start right away.  
""Ben Morrison, listen, I don’t know how highly rated he was the only guy in that freshman class to start this year,” Freeman continued. ""We’ve had a couple guys that played, but the majority of guys redshirted. Highly recruited guys, highly rated guys. But they’ve decided to stay and say, hey I’ve got to develop, I’ve got to continue to commit to a program and this team and my development. Those are the guys we need, because as you look back two years ago, a lot of those guys, the Blake Fishers, Joe Alts and some of those guys, those are the ones that are playing a lot of ball for you now. It takes time to really make that adjustment from playing high school to playing major college football. So we need guys that understand the value of this place and what it will provide in the long run, because you’re not just going to get that instant gratification that some guys are looking for.”
Irish Breakdown Fans be sure to get your Notre Dame tickets from SI Tickets HERE
Be sure to check out the Irish Breakdown message board, the Champions Lounge
Irish Breakdown Content
Notre Dame 2022 Roster Notre Dame 2022 Schedule
Notre Dame 2023 Class Big Board Notre Dame 2023 Commits Board - Offense Notre Dame 2023 Commits Board - Defense
Notre Dame 2023 Scholarship Offers Notre Dame 2024 Scholarship Offers  Ranking The 2022 Signees - Offense Ranking The 2022 Signees - Defense
———————
Become a premium Irish Breakdown member, which grants you access to all of our premium content and our premium message board! Click on the link below for more.
BECOME A MEMBER
Be sure to stay locked into Irish Breakdown all the time!
Join the Irish Breakdown community! Subscribe to the Irish Breakdown YouTube channel Subscribe to the Irish Breakdown podcast on iTunes Follow me on Twitter: @SeanStires Like and follow Irish Breakdown on Facebook
Sign up for the FREE Irish Breakdown daily newsletter","Sports Illustrated Notre Dame Fighting Irish News, Analysis and More","Jayden limar, Benjamin morrison, Football, Keon keeley, Notre dame football, Marcus freeman, Notre dame, Peyton bowen, Dante moore, Nil",Sean stires,"Thu, 22 Dec 2022 23:15:55 GMT","Name, image and likeness money played a big part though in other Notre Dame de-commitments. Irish head coach Marcus Freeman discussed it in detail",https://www.si.com/.image/c_limit%2Ccs_srgb%2Ch_1200%2Cq_auto:good%2Cw_1200/MTg4OTk1Mjg5OTIxNjI3NjA0/marcus-freeman.png
https://www.si.com/college/notredame/recruiting/notre-dame-football-2023-recruiting-class-grades-defense-edition,Notre Dame 2023 Recruiting Class Grades - Defense Edition,"Handing out position-by-position grades for the Notre Dame 2023 defensive recruiting class
Building a championship roster requires stacking strong groups on top of each other. Notre Dame landed an outstanding defensive line class in 2022, and it needed to land another one in 2023. While much of the focus will be on what was lost, what Notre Dame landed was still quite good.
Let's hand out grades, which consist of meeting needs from a numbers/depth standpoint, talent of the signees and fit into the system and culture.
Grade: BSignees: Devan Houstan, Armel Mukam, Boubacar Traore, Brenan Vernon
Notre Dame needed a four-man class in 2023 and they got that group. Notre Dame needed to add length and size to the depth chart, and it met those needs. Notre Dame also needed to add impact talent, and that's the part that drags the class down a bit.
It's a good group, a group a lot of teams would want, but it's not an elite group as it currently stands. I'm not as concerned about not landing an edge rusher due to what Notre Dame has from last year's class, but there is a lot of boom or bust talent in the class. If some of the high upside players pan out this grade jumps up, but there's also a chance it drops of they play closer to their floors.
This is a versatile group of players with a lot of length and tools. Brenan Vernon was in the class a very long time, and where he ends up will be interesting. More of a big end when he committed, Vernon has filled out quite a bit and could project as an interior guy in college. If he can stay healthy the Ohio native could be a standout for the Irish. Traore has exceptional tools, but he's quite raw. Mukam's ceiling is also very high, but he too is quite raw.
I'd argue the highest floor in the class is Houstan, whose game I really like. He could play anywhere from 5-tech to nose tackle. Houstan is longer than recent interior players, which is a need, and I see him growing into a disruptive playmaker up the middle.
Grade: ASignees: Jaiden Ausberry, Drayk Bowen, Preston Zinter
For the second straight year Notre Dame has landed one of the best linebacker hauls in the country. The rankings drop that Ausberry and Bowen had after they committed to Notre Dame is one of the many examples of why the national rankings are flawed and relatively useless to use as a driver for evaluating this class. Both were Top 50 caliber players when they picked Notre Dame and both were even better as seniors than they were as juniors.
Bowen had a monster senior season and he projects at both Mike and Will, and it wouldn't shock me if he played some on the edge as well. Bowen can run and hit, and he's a leader of this class. Ausberry can also run and hit, and he's a smooth linebacker with an incredibly high football IQ.
I've talked to sources that believe Zinter might have the highest ceiling in the class. That's not how I grade it, but it speaks to how good this group is. If I had a knock on this class it would be that I don't see it playing as well as a three man group (Rover, Mike, Will) as last year's haul, but with Bowen and Zinter both having tools to play Vyper in some looks this group can get on the field together.
Depth needs met? Check. Upgrade in athleticism? Check. Impact potential? Check. Versatility? Check. I love this linebacker haul.
Grade: ASignees: Micah Bell, Christian Gray
Notre Dame landed an A grade at cornerback for the second straight year, and Mike Mickens has quickly and completely overhauled his position. Very few teams in the country, if any, have out-recruited Notre Dame at cornerback in the last two years.
Gray is a long and smooth playmaker at cornerback with outstanding speed and athleticism. The St. Louis native has the tools to be an impactful boundary corner, but he also has the length and range to play the field spot in a manner that looks a lot like how Cam Hart plays it. Bell is a dynamic athlete and is arguably the fastest cornerback in the country. His game is a bit raw but his tools are outstanding beyond just his speed.
Gray and Bell could easily be on the field together, and they are both ideal scheme fits for the Notre Dame defense. Whether it's Marcus Freeman or Al Golden running it, the Irish defense wants to play a lot more man coverage, and that fits both Gray and Bell. It's hard to land pure cover players in today's era, and Notre Dame landed two of the better pure cover players in the country in 2023.
Grade: BSignees: Brandyn Hillman, Ben Minich, Adon Shuler
Notre Dame missed out on a chance for an elite safety haul, and that is something that will always be part of the narrative. But with Peyton Bowen out of the class you should now view Hillman as a safety, and that changes the narrative a bit for me.
Notre Dame needed to land three safeties in the class, and talking to sources the plan was always to have Hillman be a guy that could play safety if they lost Bowen. If they landed Bowen then Hillman could project at safety still, or you could use him at other spots. But landing him late was big for the Irish in many ways, and it gave them protection in case Bowen did what he ultimately did.
This isn't a group with the high end talent, at least not from a current grade standpoint, but it's a quality group nonetheless. All three are four-star prospects on the Irish Breakdown board, all have room to get better and they fit well together. Minich has the range to play the alleys and centerfield, Shuler can be an alley guy or even a rover in a true 4-2-5, and Hillman can do that as well. This group can play together, and that's key.
It's an athletic group, it's a highly productive group and although it will be a unit that fans constantly say ""what if,"" there's no denying the Irish staff improved the position by landing this group of defenders.
Grade: B+
I battled back and forth between B+ and A- but I'm going to go with B+ because of the questions I have about the floor vs ceiling gap along the defensive line. This is a very, very good group of defensive players. Notre Dame met needs, it landed potential impact players on all three levels and it continues to recruit the cornerback position at an elite level. If you're able to focus on what is and not what could have been it's hard not to really like this group.
GRADE KEY
A — Elite / College Football Playoff caliberB — Outstanding / Top 15 caliberC — Solid / Borderline Top 25 caliberD — Subpar / Not good enoughF — Disaster
Irish Breakdown Fans be sure to get your Notre Dame tickets from SI Tickets HERE
Be sure to check out the Irish Breakdown message board, the Champions Lounge
Irish Breakdown Content
Notre Dame 2022 RosterNotre Dame 2022 Schedule
Notre Dame 2023 Scholarship OffersNotre Dame 2024 Scholarship OffersRanking The 2022 Signees - OffenseRanking The 2022 Signees - Defense
———————
Become a premium Irish Breakdown member, which grants you access to all of our premium content and our premium message board! Click on the link below for more.
BECOME A MEMBER
Be sure to stay locked into Irish Breakdown all the time!
Join the Irish Breakdown community!Subscribe to the Irish Breakdown YouTube channelSubscribe to the Irish Breakdown podcast on iTunesFollow me on Twitter: @CoachD178Follow me on Gettr: @IrishBreakdownLike and follow Irish Breakdown on Facebook
Sign up for the FREE Irish Breakdown daily newsletter","Sports Illustrated Notre Dame Fighting Irish News, Analysis and More","Christian gray, Brenan vernon, Adon shuler, Ben minich, Notre dame football, Preston zinter, Boubacar traore, Devan houstan, Drayk bowen, Micah bell, Notre dame, Jaiden ausberry, Recruiting, Armel mukam",Bryan driskell,"Thu, 22 Dec 2022 18:20:17 GMT",Handing out position-by-position grades for the Notre Dame 2023 defensive recruiting class,https://www.si.com/.image/c_limit%2Ccs_srgb%2Ch_1200%2Cq_auto:good%2Cw_1200/MTk0NjE3NDIzMDUwMDU2ODY2/notre-dame-defense-class.png
