url,headline,body,source_name,categories,authors,datepub,description,image
https://www.si.com/college/notredame/recruiting/notre-dame-football-recruiting-two-year-grades-defense-2022-2023,Notre Dame Recruiting Two-Year Grades - Defense Edition,"Grading the Notre Dame recruiting efforts on defense over the last two years
One of the best ways to evaluate a team's recruiting efforts is to look at how it stacked classes on top of each other. It gives far more context to how a team is building its roster, and Notre Dame's defense has loaded up on big time talent in the 2022 and 2023 classes.
Position grades for the class are based on the player grades coming out of high school, not based on what the previous class has done, or not done, in college. Grades are based on how well Notre Dame met its needs, the talent of the group and fit. One adjustment is that players in the 2022 class will be listed where they are currently playing.
Here are the two-year grades for the Notre Dame defense:
Grade: B+Signees (8): Josh Burnham (2022), Tyson Ford (2022), Aiden Gobaira (2022), Donovan Hinish (2022), Devan Houstan (2023), Armel Mukam (2023), Boubacar Traore (2023), Brenan Vernon (2023)
This is a very unique blend of recruiting classes for the Irish defensive line. The 2022 class, which now has Josh Burnham as part of the group, had three players that I gave Top 100 caliber grades too. That includes Burnham, Ford and Gobaira. The 2023 group brings a lot more side, equally high ceilings, but it's also a group that adds a lot of size to the unit.
I'm very curious to see how Notre Dame plans to run the defense moving forward. If they start using more of the hybrid 3-3 that Marcus Freeman ran in 2021 as the DC, this grade would actually go up even more. You have a lot of big, power ends that would thrive in a 3-down look, but not a lot of pure edge players outside of Burnham, and potentially Junior Tuihalamaka, who right now I still have listed as a linebacker.
Speaking of Burnham, he has exceptional length and athleticism for the position, but obviously he is raw since he played quarterback and middle linebacker in high school. He has the athletic traits to be a star, but the question is whether or not the position will become natural for him. Gobaira is a long, twitchy edge player that has to fill out and Ford is a power player with a lot of upside. Hinish is a high motor player with better athleticism than his brother.
The 2023 class added a much-needed infusion of power and size. Vernon and Traore have extremely high ceilings, Houstan has a chance to be a standout inside either at 3-technique or the nose, and Mukam is another raw but toolsy player. I talk a lot about upside and potential with this class, and that's what makes it exciting, but the fact I have to focus so much on potential and tools, and not as much on proven ability or the ability to help immediately is what drags this grade down a tad, as does the fact there isn't a true nose player in the group. 
Grade: ASignees (6): Jaylen Sneed (2022), Junior Tuihalamaka (2022), Nolan Ziegler (2022), Jaiden Ausberry (2023), Drayk Bowen (2023), Preston Zinter (2023)
Notre Dame signed one of the two to three best linebacker hauls in the country each of the last two seasons. I had the 2022 haul as the best in the land, but that changes with Burnham moved to defensive end. It's still one of the best, just not clearly the very best without him. But when you look at this two-year haul together you see versatility, tons of talent and a whole lot of athleticism.
Sneed is the most physically gifted player of this group, possessing elite athleticism and loads of potential. He's not quite as nuanced at the position as most of the other players at the group, but his ceiling is exceptionally high. Ausberry and Bowen in the 2023 class are also exceptionally toolsy and grade out as Top 100 recruits on the IB Board. That gives Notre Dame three players to earn that grade, or better, and Ziegler wasn't that far off. The amount of athleticism and range in that foursome is truly outstanding.
We will see if this group can emerge as impact players, but we won't be hearing criticisms about the lack of athleticism at linebacker in the future the way the staff has recruited the position since Freeman arrived. 
Tuihalamaka isn't the athlete the other players are, but he's huge, instinctive and a thumper. We'll see if he sticks at linebacker, but if he does he brings a needed power profile to the group. Zinter is a sleeper pickup, and one that could surprise some people thanks to his length, strong all-around athleticism and versatility.
Grade: ASignees (4): Jaden Mickey (2022), Benjamin Morrison (2022), Micah Bell (2023), Christian Gray (2023)
This had been a concern for the Irish program for years, but Mike Mickens has quickly turned it into a strength. Mickens has landed three strong cornerback classes in a row, but the 2022 and 2023 hauls is as good as we've seen at this position in decades. I even grade it out higher than the 2006-07 hauls that were the previous standard for cornerback recruiting.
Morrison became an immediate star at Notre Dame, but he wasn't a surprise to IB, as the Arizona native earned a Top 100 grade and a 5.0-star upside grade on the IB board. Since it would look like I am speaking about how well he played this season, here's a quote from the IB evaluation of him when he signed:
""Morrison is a very smooth and impressively fluid athlete. He possesses impressive foot quickness, fluid hips and his transitions are clean and quick. Morrison can change direction with ease, both when asked to plant and drive downhill and when asked to open up and run. His ability to quickly flip his hips, both with the initial stem and when handling double moves down the field is outstanding.""
"".... Morrison is the ideal Notre Dame cornerback. He's long, he can play man coverage at a high level and he's physical on the perimeter as both a run defender and against the screen game. As I mentioned above, Morrison has all the tools to be a strong boundary cornerback, where he can be a legit one-on-one player.""
This is what I wrote about the 2022 cornerback grade:
""If I'm right about Morrison this is an A class, if I'm wrong about Morrison this is more of a B to B+ class.""
The point of this is to show that the grade above is based on what we saw from Morrison coming out of high school, as well as our grades for Bell and Gray, who earned Top 100 grades, and Mickey, who earned a Top 150 grade. This is an outstanding haul of cornerbacks, as good as anyone in the country. This is no a retroactive grade based on how brilliant Morrison was as a true freshman.
Grade: B-Signees (3): Brandyn Hillman (2023), Ben Minich (2023), Adon Shuler (2023)
This is the group that drags the grade down a bit. Notre Dame completely struck out on safeties in the 2022 class, and it ended up moving Jayden Bellamy there last fall, but Bellamy isn't included here because he has already left the program, so the Irish are back to having zero safeties in the 2022 class. I like the talent of the 2023 class, but it lacks the immediate impact player that it needed to have in order to overcome the depth issues that already exist on the roster.
That doesn't mean Shuler and Minich can't help as freshmen, but both would likely ideally need a year to get acclimated and build up their bodies before being thrust into prominent roles. They might not get that chance due to how limited the current depth chart is.
Having said that, the 2023 class by itself, taking needs out of the grade, was quite good. Hillman is a long, dynamic athlete that has a lot to learn about the position, but his tools are outstanding. I could see him playing deep at safety, or perhaps developing into a 3-3-5 type of safety that plays sort of a rover role. Shuler could do that as well, but I love the idea of him playing the alleys. Minich can do a little bit of everything, and he's one of the headiest players in the class, but don't let that fool you, he's athletic as well.
It's a good group, but the numbers issues and lack of top level talent drags the grade down.
Grade: B+
The floor vs ceiling aspect of the defensive line and the depth issues at safety are what keep this grade from being in the A range. Notre Dame recruited linebacker and cornerback as well as any program in the country the last two years, and the upside of the defensive line class is such that if just 3-4 of those guys hit the front will be outstanding. Safety needs to be addressed better in 2024, but the 2023 class helped salvage things by adding three really good football players. Notre Dame is closing the gap on defense, there's no doubt about that.
GRADE KEY
A — Elite / College Football Playoff caliberB — Outstanding / Top 15 caliberC — Solid / Borderline Top 25 caliberD — Subpar / Not good enoughF — Disaster
Irish Breakdown Fans be sure to get your Notre Dame tickets from SI Tickets HERE
Be sure to check out the Irish Breakdown message board, the Champions Lounge
Irish Breakdown Content
Notre Dame 2022 RosterNotre Dame 2022 Schedule
Notre Dame 2023 Class Big BoardNotre Dame 2023 Commits Board - OffenseNotre Dame 2023 Commits Board - Defense
Notre Dame 2023 Scholarship OffersNotre Dame 2024 Scholarship OffersRanking The 2022 Signees - OffenseRanking The 2022 Signees - Defense
———————
Become a premium Irish Breakdown member, which grants you access to all of our premium content and our premium message board! Click on the link below for more.
BECOME A MEMBER
Be sure to stay locked into Irish Breakdown all the time!
Join the Irish Breakdown community!Subscribe to the Irish Breakdown YouTube channelSubscribe to the Irish Breakdown podcast on iTunesFollow me on Twitter: @CoachD178Follow me on Gettr: @IrishBreakdownLike and follow Irish Breakdown on Facebook
Sign up for the FREE Irish Breakdown daily newsletter","Sports Illustrated Notre Dame Fighting Irish News, Analysis and More","Tyson ford, Drayk bowen, Brandyn hillman, Junior tuihalamaka, Notre dame football, Preston zinter, Brenan vernon, Jaylen sneed, Jaiden ausberry, Micah bell, Nolan ziegler, Adon shuler, Armel mukam, Christian gray, Ben minich, Notre dame, Donovan hinish, Aiden gobaira, Recruiting, Josh burnham, Jaden mickey, Devan houstan, Benjamin morrison, Boubacar traore",Bryan driskell,"Fri, 23 Dec 2022 18:03:10 GMT",Grading the Notre Dame recruiting efforts on defense over the last two years,https://www.si.com/.image/c_limit%2Ccs_srgb%2Ch_1200%2Cq_auto:good%2Cw_1200/MTk0NjQxMTIzNzUzMzM4MDE4/jaylen-sneed---drayk-bowen.png
https://www.si.com/college/notredame/recruiting/notre-dame-football-recruiting-two-year-grades-offense-2022-2023,Notre Dame Recruiting Two-Year Grades - Offense Edition,"Grading the Notre Dame recruiting efforts on offense over the last two years
One of the best ways to evaluate a team's recruiting efforts is to look at how it stacked classes on top of each other. It gives far more context to how a team is building its roster, and the Notre Dame offense has used the two-year haul of the 2022 and 2023 classes to give the roster a major boost.
Position grades for the class are based on the player grades coming out of high school, not based on what the previous class has done, or not done, in college. Grades are based on how well Notre Dame met its needs, the talent of the group and fit.
Here are the two-year grades for the Notre Dame offense:
Grade: B+Signees (2): Steve Angeli (2022), Kenny Minchey (2023)
Landing Minchey played a big role in Notre Dame improving the future of its quarterback position. If you look at things from a three-year view, the 2020-22 classes were Drew Pyne, Tyler Buchner and Steve Angeli. That's one impact quarterback and two solid game manager types. When looking at the three year view of Buchner, Angeli and Minchey you see two impact players and a game manager. That's how you properly build a quarterback depth chart.
Minchey is one of the best quarterbacks in the 2023 class and he's a great fit for the Tommy Rees offense. He's smart, he has a great feel for the game, he is accurate and he throws a good deep ball. Minchey also has the ability to make plays outside the framework of the offense, especially as a passer. He has the frame, football intelligence and arm talent to player early in his career if the need arises.
Angeli is a solid all-around prospect. He has a quick release, possesses impressive leadership traits and he shows good game manager skills.
Grade: ASignees (3): Gi'Bran Payne (2022), Jadarian Price (2022), Jeremiyah Love (2023)
Notre Dame has done a great job restocking the running back depth chart in recent seasons, and landing Love in the 2023 class made it four straight seasons the Irish loaded up with big time prep prospects. Price and Love both graded out as Top 100 recruits on the IB board.
Price and Love are both home run hitters that also bring every down back tools to the game. Price is a bit more of a vertical runner while Love possesses impressive make-you-miss skills. Both are impact players in the pass game, and there is no doubt that Notre Dame can use them together as part of a rotation or on the field at the same time in its 21 personnel packages.
Payne graded out as a four-star recruit as well despite missing much of his final two seasons with injuries. If he is able to get back to full health this backfield will be as deep as its been in decades. There aren't many teams in college football that have recruited the running back position as well as Notre Dame has the last two seasons.
Grade: B+Signees (5): Tobias Merriweather (2022), Rico Flores Jr. (2023), Jaden Greathouse (2023), Braylon James (2023), Kaleb Smith (2023)
This grade gets dragged down because of numbers. Notre Dame hit their numbers mark in 2023 but the 2022 class was two players short. That means over a two-year span the Irish didn't land a full two-deep.
That's the negative, the positive is that the talent Notre Dame did land is outstanding. Merriweather was my top-ranked offensive recruit and a Top 50 overall national player on the IB Board with the 2022 class. He's long and fast, possessing the tools to be a dominant pass catcher at the next level. 
Notre Dame's 2023 class added a deep group of talented wideouts, and a group that brings a variety of skills. That diverse set of skills was incredibly needed. James brings home run speed, Greathouse brings an advanced game with the tools to be a volume pass catcher, Smith is fast and has impressive after-the-catch skills, and Flores is one of the most advanced route runners in the class.
If this group comes close to its full potential the Irish will have one of the better group of pass catchers in all of college football.
Grade: ASignees (3): Eli Raridon (2022), Holden Staes (2022), Cooper Flanagan (2023)
As expected, Notre Dame has recruited tight end as well as any program in the country over the last two years. Raridon graded out as a Top 100 recruit on the IB board and both Staes and Flanagan are Top 200 caliber prospects, but both have high ceilings and the potential to be outstanding college tight ends.
Raridon's injury history is problematic but he possesses all the tools to be an elite college tight end. He's long, fast, has great ball skills and as a senior he showed much-improved blocking ability. Staes is a great complement to Raridon in that he can do a lot of the detached aspects of the game. His game is quite raw but his combination of athleticism, ball skills and length make him a potential impact player in the pass game. 
Flanagan has a lot of throwback in him. He can do damage in the pass game, but right now his strength is as a dominant run blocker. That makes him a great complement to the 2022 tight ends, who are first pass catchers, although Raridon also shows strong blocking potential.
Grade: A-Signees (9): Ty Chan (2022), Ashton Craig (2022), Billy Schrauth (2022), Aamil Wagner (2022), Sullivan Absher (2023), Charles Jagusah (2023), Joe Otting (2023), Sam Pendleton (2023), Christopher Terek (2023)
There is a lot to like about the two offensive line hauls in 2022 and 2023. The 2022 group added a lot of athleticism to the roster, while the 2023 group added a lot of size and physicality. Notre Dame met its numbers needs in these two hauls, there is good top of the board talent, and there is a lot of impressive upside. The one question mark about this group, the thing that keeps it from being an A, is my question about whether or not it has the necessary tackle depth.
Wagner and Jagusah both have the tools to be left tackles in college, with Wagner possessing elite length and athleticism and Jagusah possessing massive size and elite power. The question mark with Wagner is can he add enough mass to his frame to handle the rigors of college football while maintaining his athleticism. Jagusah's left tackle question comes more from whether or not another position might be better for him. If this left tackle question gets answered favorably this group will be outstanding.
Jagusah and Schrauth are both top talents and both graded out as Top 100 recruits. There isn't a ton of star power in this group, but Wagner has elite upside, and if he hits his mark it will give the Irish the star power it needs to be a dominant line, should that line be made up of the players from these two classes. What makes it such a great haul isn't the star power, however, it's the depth of really good football players. There's only one lineman in this 9-man haul to earn below a 4.5-star upside grade, which is really impressive. It has a combination of size, power, athleticism and upside. It just needs to answer the tackle question.
2022 signee Joey Tanona is not listed in this group due to his career already being ended due to a tragic accident.
Grade: A-
Notre Dame needed a strong two-year haul on offense and it got that. The Irish landed at least one potential impact player at every position, and at every position but quarterback it added multiple players at each position with impact upside. Notre Dame's staff was able to largely overcome numbers issues with the 2023 class, and the skill talent that is heading to South Bend out of these two classes is as good as we've seen in back-to-back classes in a very, very long time.
There is no question that Notre Dame is closing the gap with these two offensive classes.
A — Elite / College Football Playoff caliberB — Outstanding / Top 15 caliberC — Solid / Borderline Top 25 caliberD — Subpar / Not good enoughF — Disaster
Irish Breakdown Fans be sure to get your Notre Dame tickets from SI Tickets HERE
Be sure to check out the Irish Breakdown message board, the Champions Lounge
Irish Breakdown Content
Notre Dame 2022 Roster Notre Dame 2022 Schedule
Notre Dame 2023 Class Big Board Notre Dame 2023 Commits Board - Offense Notre Dame 2023 Commits Board - Defense
Notre Dame 2023 Scholarship Offers Notre Dame 2024 Scholarship Offers  Ranking The 2022 Signees - Offense Ranking The 2022 Signees - Defense
———————
Become a premium Irish Breakdown member, which grants you access to all of our premium content and our premium message board! Click on the link below for more.
BECOME A MEMBER
Be sure to stay locked into Irish Breakdown all the time!
Join the Irish Breakdown community! Subscribe to the Irish Breakdown YouTube channel Subscribe to the Irish Breakdown podcast on iTunes Follow me on Twitter: @CoachD178 Follow me on Gettr: @IrishBreakdown Like and follow Irish Breakdown on Facebook
Sign up for the FREE Irish Breakdown daily newsletter","Sports Illustrated Notre Dame Fighting Irish News, Analysis and More","Recruiting, Charles jagusah, Jadarian price, Ty chan, Sam pendleton, Eli raridon, Notre dame, Sullivan absher, Notre dame football, Holden staes, Rico flores jr., Kaleb smith, Braylon james, Cooper flanagan, Tobias merriweather, Ashton craig, Steve angeli, Christopher terek, Jaden greathouse, Aamil wagner, Billy schrauth, Kenny minchey, Joe otting, Jeremiyah love",Bryan driskell,"Fri, 23 Dec 2022 16:46:39 GMT",Grading the Notre Dame recruiting efforts on offense over the last two years,https://www.si.com/.image/c_limit%2Ccs_srgb%2Ch_1200%2Cq_auto:good%2Cw_1200/MTk0NjQxMTIzNzUzMzM4Mzky/braylon-james---tobias-merriweather.png
