url,headline,body,source_name,categories,authors,datepub,description,image
https://www.si.com/college/notredame/recruiting/notre-dame-football-2023-recruiting-class-grades-offense-edition,Notre Dame 2023 Recruiting Class Grades - Offense Edition,"Handing out position-by-position grades for the Notre Dame 2023 offensive recruiting class
Notre Dame has wrapped up its 2023 recruiting class by landing an outstanding group of offensive recruits. It was a bit of a winding road for the Notre Dame offensive coaches, but once the current group was put together it hit the ground running and earned a lot of impressive wins.
Notre Dame needed a great year on this side of the ball and got it. Let's hand out grades, which consist of meeting needs from a numbers/depth standpoint, talent of the signees and fit into the system and culture.
Grade: A-Signee: Kenny Minchey
This was an incredibly wild ride, but in the end I think Notre Dame not only landed one of the best quarterbacks in the class, they landed a kid who is a perfect fit for the program. During the summer while he was still committed to Pitt I ranked Minchey as the No. 81 overall player in the country and as the No. 7 overall quarterback in a loaded quarterback class. Notre Dame needed to land a Top 10 quarterback in this class and they got one.
Minchey also fits what OC Tommy Rees wants quite nicely. Minchey earns rave reviews from everyone that engages with him in a football context for his football IQ. He's one of the smartest quarterbacks in the class and shows the ability to absorb a lot of offense, that's important for Notre Dame. That intelligence plays itself out on the field, where Minchey plays with great anticipation and decision making. He has a fast, compact release, he shows excellent ball placement and touch, and he can get the ball out with velocity and can attack defenses over the top.
He's mobile, but his mobility is primarily used to buy time as a passer. When he does run he can be a chain mover that can run some read zone concepts to pull it and get out the backside, but he'll be better suited on RPOs than read zones. All he is really missing to be the ideal passer is a couple of more inches of height, and his grade also comes down a tad because he missed half of his senior season.
Grade: A-Signee: Jeremiyah Love
Notre Dame only needed one running back in this class, but it wanted two, and the fact it didn't get what it wanted is why this grade dropped down to an A-. If we're talking about what they needed, and the talent they landed, it's hard to argue with where things ended up. After landing two very good backs in 2021 (Logan Diggs, Audric Estime) and an incredibly talented back in 2022 (Jadarian Price), Notre Dame needed a big time player in the 2023 class and they got one with Love.
Notre Dame got on Love relatively early, and when they landed him he was a dynamic athlete that was a bit raw and tools as a player, but his game needed a lot of technical work. As a senior, Love really broke out and played dominant football. His vision and feel for the game took a huge leap, he was thicker and ran with more authority, and he did all that while maintaining his home run skills.
Love looked natural as a runner as a senior and his game took off, but he's also a major weapon in the pass game. He fits the Notre Dame offense quite well, and he showed he's a money player. In 8 career playoff games, Love rushed for 1,022 yards and 17 touchdowns on just 92 carries (11.1 YPC).
Grade: ASignees: Rico Flores Jr., Jaden Greathouse, Braylon James, Kaleb Smith
It's hard to imagine the 2023 recruiting cycle ending up much better for Notre Dame than this four man haul, which will be able to stand up against any receiving class in the country. Notre Dame hit an A grade for need, fit and talent with this four-man haul.
Notre Dame has a long home run hitter in James, a dominant high volume pass catcher in Greathouse, one of the best route runners in the country in Flores and they landed a player in Smith that brings much-needed shiftiness and big play potential with the ball. Not one of these players is pigeonholed into one position either, as both can line up in at least two positions in the Notre Dame offense.
Beyond numbers needs, Notre Dame needed to add more big play ability and it needed to add more size to the roster. It also needed at least two players that can come in and play right away, and the grades for each of those categories is high as well. James and Smith both have electronic 40-yard dash times in the 4.4 range, and both show home run ability while playing in Texas. Greathouse is one of the most ready to play wideouts in the country, and Flores should have a chance to play early as well thanks to his polish, feel for the game and hands.
This group erases many of the roster issues that were created by the predecessor to Chansi Stuckey, and it was a grand slam home run for the first year receivers coach.
Grade: B+Signee: Cooper Flanagan
Notre Dame only needed one tight end in the class and it needed a tight end that was more traditional in his style of play. Landing Flanagan checked both of those boxes. He is a bit of a throwback tight end thanks to his impressive size (6-5, 240) and his ability to line up attached to the line and to dominate as a run blocker.
Flanagan is a quality athlete and pass catcher as well, so he's far from being just a physical one trick pony. He will do a lot of work from a traditional tight end alignment, but he has a chance to be a pass game weapon as well. Flanagan nicely complements the one-two punch of Eli Raridon and Holden Staes that Notre Dame signed in the 2022 class.
Notre Dame could use a player like Flanagan in the lineup next season, so the Irish get a bit of a bump up in grade here to a B+ because they landed a player with the tools to come in and compete for an immediate role.
Grade: A-Signee: Sullivan Absher, Charles Jagusah, Joe Otting, Sam Pendleton, Christopher Terek
Notre Dame hit all the marks needed in this class. The Irish needed four offensive linemen in this class, but the staff wanted five. It met that need. Notre Dame needed to add some players that could compete in the interior, and it met that need. Notre Dame needed a left tackle in the class, and it got one of the best in the country. It needed two players who could play tackle, and it got that.
Jagusah is a five-star recruit that showed as a senior that he could play left tackle of the need arises. He could also easily step into the right tackle spot or a guard spot and be just as dominant. The potential he flashed as a junior turned into consistent production as a senior, and his grade took off. Jagusah always had a five-star upside grade, but that upside became reality this season. Having a player of his talent anchor this class is a big part of the reason it earned an A- grade beyond the depth needs.
Pendleton, Terek and Otting are all tackles in high school but project as interior players. Pendleton is a sound player that brings brute force to the game, Otting is an athletic player with a very high ceiling and Terek is a grinder. The key to this class, and what will ultimately determine if it lives up to its grade is Absher. He's very, very toolsy but comes from an option offense and he has a big transition to make. If he pans out, either as a right tackle or dominant guard, this class will be big time.
The Irish also needed an infusion in brute force, and honestly that might be the best part of this class. All five players, including the undersized Otting, are physically dominant players that punish defenders on the regular.
Grade: A-
There are a couple of areas where a talent upgrade could be had, but overall this is a very balanced, talented and deep offensive class. It landed one of the best quarterbacks in the country, it landed five impact skill players, it landed speed, it landed size, it met its needs for players that can help early on and of course at the foundation is a big, deep and physical offensive line class.
Any criticisms with this class would be around the degree of the talent, and we're arguing about whether it should be an A, A- or B+. That's a great place to be, and it was an absolute must to land this type of class after what happened at the end of the 2022 cycle and after the 2020 and 2021 classes had so many injuries and departures.
GRADE KEY
A — Elite / College Football Playoff caliberB — Outstanding / Top 15 caliberC — Solid / Borderline Top 25 caliberD — Subpar / Not good enoughF — Disaster
Irish Breakdown Fans be sure to get your Notre Dame tickets from SI Tickets HERE
Be sure to check out the Irish Breakdown message board, the Champions Lounge
Irish Breakdown Content
Notre Dame 2022 RosterNotre Dame 2022 Schedule
Notre Dame 2023 Scholarship OffersNotre Dame 2024 Scholarship OffersRanking The 2022 Signees - OffenseRanking The 2022 Signees - Defense
———————
Become a premium Irish Breakdown member, which grants you access to all of our premium content and our premium message board! Click on the link below for more.
BECOME A MEMBER
Be sure to stay locked into Irish Breakdown all the time!
Join the Irish Breakdown community!Subscribe to the Irish Breakdown YouTube channelSubscribe to the Irish Breakdown podcast on iTunesFollow me on Twitter: @CoachD178Follow me on Gettr: @IrishBreakdownLike and follow Irish Breakdown on Facebook
Sign up for the FREE Irish Breakdown daily newsletter","Sports Illustrated Notre Dame Fighting Irish News, Analysis and More","Recruiting, Deland mccullough, Charles jagusah, Sullivan absher, Braylon james, Notre dame football, Cooper flanagan, Rico flores jr., Kaleb smith, Christopher terek, Joe otting, Chansi stuckey, Sam pendleton, Kenny minchey, Harry hiestand, Tommy rees, Jaden greathouse, Jeremiyah love, Notre dame",Bryan driskell,"Thu, 22 Dec 2022 16:45:36 GMT",Handing out position-by-position grades for the Notre Dame 2023 offensive recruiting class,https://www.si.com/.image/c_limit%2Ccs_srgb%2Ch_1200%2Cq_auto:good%2Cw_1200/MTk0NjE3MjgwNTEwODMwMTA0/notre-dame-offense-class.png
https://www.si.com/college/notredame/recruiting/notre-dame-football-signs-offensive-lineman-christopher-terek-2023,Notre Dame Signs Offensive Lineman Christopher Terek,"Notre Dame has signed standout Illinois offensive lineman Christopher Terek
Notre Dame has officially landed Christopher Terek, one of the more physically opposing offensive lineman in the Midwest.
Hometown/High School: Glen Ellyn, Ill. / Glenbard WestHeight/Weight: 6-6, 305
IB Grade: 3.5 (Top 300-350 caliber prospect)Upside Grade: 4.0
Recruited By: Harry Hiestand 
Offers: Notre Dame, Michigan, Wisconsin, Iowa, Kentucky, Minnesota, Missouri, Boston College, Illinois, Vanderbilt, Iowa State, Kansas, Duke
Honors: 8A All State First Team (2022 and 2021) 
Player Comp: Josh Lugg, Notre Dame
Rivals: 4-star - No. 227 overall - No. 12 IOL247Sports: 3-star - No. 48 IOLOn3: 3-star - No. 52 IOLESPN: 3-star - No. 55 IOLComposite: 3-star - No. 43 IOL
Terek is a tackle for Glenbard West and he has a tackle frame, which is often what Harry Hiestand has focused on in the past. What Hiestand has done is take tackle bodies and then move some inside, and Terek fits that mold from a physical standpoint. His game is certainly suited for the interior of the offensive line. Terek is a powerful short-area player that thrives with the physical part of the game. His game should take a jump with a move inside, where he can handle the run game and he should be even a better fit in pass protection inside. Notre Dame also looked to add players with a more physical demeanor in this class, and Terek fits that mold as well.
Ryan Roberts, Director of Recruiting: “Terek is the ideal offensive guard on the next level, with the ability to also give you some snaps at offensive tackle in a pinch. He plays with tremendous physicality and effort as a blocker. Once he is able to establish inside positioning, it's over.”
John Garcia Jr.: ""Bookend tackle frame with college-ready build and experience in modern scheme. Wide pass stance with extension and enough driving ability to work gap or pass-off plays without wasted movement. Good athlete comfortable re-routing in short spaces with reach blocking range off the snap. Encouraging leverage off the ball relative to height despite somewhat raw technical ability while working in the wash. Best football is well ahead.""
Glenbard West Head Coach Chad Hetlet: “Christopher plays the game the right way. He works hard and he plays hard. He is a tone setter in the run game. It was a true privilege to be able to coach him.” 
Irish Breakdown Fans be sure to get your Notre Dame tickets from SI Tickets HERE
Be sure to check out the Irish Breakdown message board, the Champions Lounge
Irish Breakdown Content
Notre Dame 2022 RosterNotre Dame 2022 Schedule
Notre Dame 2023 Scholarship OffersNotre Dame 2024 Scholarship OffersRanking The 2022 Signees - OffenseRanking The 2022 Signees - Defense
———————
Become a premium Irish Breakdown member, which grants you access to all of our premium content and our premium message board! Click on the link below for more.
BECOME A MEMBER
Be sure to stay locked into Irish Breakdown all the time!
Join the Irish Breakdown community!Subscribe to the Irish Breakdown YouTube channelSubscribe to the Irish Breakdown podcast on iTunesFollow me on Twitter: @CoachD178Follow me on Gettr: @IrishBreakdownLike and follow Irish Breakdown on Facebook
Sign up for the FREE Irish Breakdown daily newsletter","Sports Illustrated Notre Dame Fighting Irish News, Analysis and More","Football, Recruiting, Christopher terek, Notre dame, Notre dame football",Bryan driskell,"Wed, 21 Dec 2022 22:05:25 GMT",Notre Dame has signed standout Illinois offensive lineman Christopher Terek,https://www.si.com/.image/c_limit%2Ccs_srgb%2Ch_1200%2Cq_auto:good%2Cw_1200/MTk0NTkyMDU5Mzg5ODQ3MDY0/christopher-terek.png
https://www.si.com/college/notredame/basketball/notre-dame-womens-basketball-overcomes-slow-start-to-beat-western-michigan-85-57-stires,Notre Dame Women's Basketball Overcomes Slow Start To Beat Western Michigan 85-57,"The Fighting Irish sputtered in the first half, but used a strong third quarter to pick up their 10th win of the season in their last pre-holiday game
Maddy Westbeld scored a season-high 23 points to lead the Notre Dame women’s basketball team to an 85-57 win over Western Michigan. The Fighting Irish (10-1) outscored the Broncos (5-6) 47-27 in the second half to overcome a lackluster first 20 minutes of play.  
Notre Dame started strong by hitting 9 of 15 shots (60%) in the first quarter. Kylee Watson hit all four of her field goal attempts to pace the Irish to a comfortable 20-12 lead, thanks in part to a defense that held Western Michigan to 4 of 13 (30%) shooting. Watson finished the game going 5 for 5 from the floor for 10 points in a little more than 19 minutes. 
The Broncos played the Irish to an 18-18 draw in the second quarter. Six Notre Dame turnovers helped keep Western within eight points at the intermission.  
Niele Ivey’s halftime speech to her team lit a much-needed fire to start the second half. The Irish defense forced nine straight misses from the field by the Broncos and ignited an offense that raced to a 17-0 run to put the game away. Western Michigan did not hit its first field goal of the second half until there was 3:02 remaining in the third quarter with Notre Dame on top 55-35.  
Westbeld was 10 for 16 from the field for her fourth consecutive double figure scoring game. She pulled down eight rebounds as well. Sonia Citron scored 16 points to run her consecutive double figure streak to 10 games. The only game she has not hit double digits was the season-opener against Northern Illinois.  
Olivia Miles scored eight points, marking the first time this season she has not scored in double figures. She dished out 12 assists with seven rebounds. 
The Irish have the next four days off for Christmas break. They will reconvene on campus next week to prepare for their Dec. 29 game at Miami.
Irish Breakdown Fans be sure to get your Notre Dame tickets from SI Tickets HERE
Be sure to check out the Irish Breakdown message board, the Champions Lounge
Irish Breakdown Content
Notre Dame 2022 Roster Notre Dame 2022 Schedule
Notre Dame 2023 Class Big Board Notre Dame 2023 Commits Board - Offense Notre Dame 2023 Commits Board - Defense
Notre Dame 2023 Scholarship Offers Notre Dame 2024 Scholarship Offers  Ranking The 2022 Signees - Offense Ranking The 2022 Signees - Defense
———————
Become a premium Irish Breakdown member, which grants you access to all of our premium content and our premium message board! Click on the link below for more.
BECOME A MEMBER
Be sure to stay locked into Irish Breakdown all the time!
Join the Irish Breakdown community! Subscribe to the Irish Breakdown YouTube channel Subscribe to the Irish Breakdown podcast on iTunes Follow me on Twitter: @SeanStires Like and follow Irish Breakdown on Facebook
Sign up for the FREE Irish Breakdown daily newsletter","Sports Illustrated Notre Dame Fighting Irish News, Analysis and More","Olivia miles, Basketball, Notre dame women's basketball, Kylee watson, Maddy westbeld, Sonia citron",Sean stires,"Wed, 21 Dec 2022 20:46:19 GMT","The Fighting Irish sputtered in the first half, but used a strong third quarter to pick up their 10th win of the season in their last pre-holiday game",https://www.si.com/.image/c_limit%2Ccs_srgb%2Ch_1200%2Cq_auto:good%2Cw_1200/MTc3MTcwOTYzOTA0MTQ0NTQ1/hoops---maddy-westbeld.png
https://www.si.com/college/notredame/football/notre-dame-football-lands-virginia-tech-transfer-wide-receiver-kaleb-smith-2023,Notre Dame Lands Virginia Tech Transfer Wide Receiver Kaleb Smith,"Notre Dame has dipped into the transfer portal and landed Virginia Tech transfer Kaleb Smith
Notre Dame has once again dipped into the transfer portal, this time landing former Virginia Tech wide receiver Kaleb Smith. The former Hokie signed with Notre Dame and will be part of the Irish team in the spring.
Smith was Virginia Tech's leading wide receiver during the 2022 season, hauling in career highs in receptions (37), yards (674) and touchdowns (3). His best performances were against NC State (3 catches, 141 yards), Pittsburgh (9 catches, 152 yards) and Georgia Tech (4 catches, 78 yards). 
Smith averaged an impressive 18.2 yards during the 2022 campaign, although his game projects as more of a possession receiver. The 6-2, 222-pound wideout played mostly in the boundary for the Hokies, but he also projects as a player that could get action in the slot in the Notre Dame offense.
Notre Dame is bringing in an outstanding four-man receiver haul in the 2023 class, and it returns talented players from the current roster (Tobias Merriweather, Deion Colzie, Lorenzo Styles, Jayden Thomas), but there was a need for depth and experience as well. Notre Dame will be quite young at wideout in 2023, and Smith brings with him a wealth of experience. He was also a team captain for the Hokes during the 2022 campaign. Smith can come in and provide the Irish with a lot of experience, but its his leadership that could provide the most value to the young but overall inexperienced Irish pass catchers.
The Louisa County native hauled in two passes for 19 yards against Notre Dame during the 2021 season. Notre Dame landed a grad transfer wide receiver in 2020 when it brought in Ben Skowronek, who went on to be a quality player for the Irish that season. The hope is that Smith can provide similar value, although snaps will be harder to come by with the 2023 wide receiver depth chart having a lot more depth and talent than the 2020 group.
Irish Breakdown Fans be sure to get your Notre Dame tickets from SI Tickets HERE
Be sure to check out the Irish Breakdown message board, the Champions Lounge
Irish Breakdown Content
Notre Dame 2022 RosterNotre Dame 2022 Schedule
Notre Dame 2023 Scholarship OffersNotre Dame 2024 Scholarship OffersRanking The 2022 Signees - OffenseRanking The 2022 Signees - Defense
———————
Become a premium Irish Breakdown member, which grants you access to all of our premium content and our premium message board! Click on the link below for more.
BECOME A MEMBER
Be sure to stay locked into Irish Breakdown all the time!
Join the Irish Breakdown community!Subscribe to the Irish Breakdown YouTube channelSubscribe to the Irish Breakdown podcast on iTunesFollow me on Twitter: @CoachD178Follow me on Gettr: @IrishBreakdownLike and follow Irish Breakdown on Facebook
Sign up for the FREE Irish Breakdown daily newsletter","Sports Illustrated Notre Dame Fighting Irish News, Analysis and More","Kaleb smith, Football, Notre dame, Notre dame football",Bryan driskell,"Wed, 21 Dec 2022 18:09:36 GMT",Notre Dame has dipped into the transfer portal and landed Virginia Tech transfer Kaleb Smith,https://www.si.com/.image/c_limit%2Ccs_srgb%2Ch_1200%2Cq_auto:good%2Cw_1200/MTk0NTk0OTA4MDI2MTg0ODY2/kaleb-smith---vt.png
