url,headline,body,source_name,categories,authors,datepub,description,image
https://www.si.com/college/notredame/recruiting/notre-dame-football-answered-some-wide-receiver-question-marks-on-signing-day,Notre Dame Answered Some Wide Receiver Question Marks On Signing Day,"Under WR Coach Chansi Stuckey, Notre Dame answered a lot of wide receiver questions on National Signing Day
The coaching rise of Notre Dame wide receiver coach Chansi Stuckey has been a fascinating one to keep tabs on. When first hearing that Stuckey was a candidate at Notre Dame there was a sudden moment of, “Wait, that Chansi Stuckey? I didn’t know he coached!”
Truthfully, you can’t really blame anyone for that reaction. After previous stops as a graduate system and an offensive player development position, which was a non-coaching position while with the Clemson program, Stuckey landed as the wide receiver coach at Baylor during the 2021 season.
The former Clemson star and NFL wideout would spend just that one season with the Bears, and wouldn’t have the opportunity to see his first recruiting class all the way through when Notre Dame came calling. So when Marcus Freeman made Stuckey a new member of the staff, his experience was the major talking point from Notre Dame fans and those who follow the program closely. 
Did that mean he couldn’t recruit? No, of course not but you also had no reason to believe that he could. The 2023 recruiting class, his first with the Irish program, was a litmus test of sorts to see what exactly Stuckey was as a recruiter. 
On a staff of proven recruiters, who have done it at an extremely high level historically, Stuckey had a lot to prove. To say he passed with flying colors would be a massive understatement. 
Stuckey used his Texas ties while with the Baylor program to his advantage early on. He had previous relationships with some extremely talented pass catchers from the state and quickly rekindled those connections.
Among the biggest early targets was Round Rock (Texas) Stony Point standout Braylon James, who was previously at Del Valle High School before he transferred back to Stony Point for his senior year. James had high interest in Notre Dame even while the previous staff was in place but had failed to get a phone call returned after a couple of attempts. 
James didn’t have to wait long to hear from Stuckey and this new staff. At 6-3 and 185 pounds with 4.47 verified speed, James is the type of freak pass catcher that Notre Dame needs to keep loading up on. If developed properly, he should be an absolute nightmare for opposing defenses on the next level. 
Arguably one of the more accomplished pass catchers in the 2023 class nationally, Austin (Texas) Westlake star Jaden Greathouse was on the board for Notre Dame upon Stuckey’s arrival. Before he came to South Bend, however, it was nothing more than a pipe dream for the Irish. There was zero traction up until that point.
That quickly changed with Stuckey, who Greathouse named consistently as one of the biggest factors in his recruitment. Greathouse is a much different athlete than James, which is an outstanding potential pairing. 
At 6-2 and 210 pounds, Greathouse is about as physical of a pass catcher as you will find nationally. He plays big boy football and clearly believes that every football in the air is only his to come down with. The Texas native is also a very nuanced pass catcher who brings some of the cleanest route running that you will find. 
Balance is the underrated part of this wide receiver group for Notre Dame. One position type that they have needed more of in recent years is true slot types who can impact the game after the catch. 
Stuckey and the Notre Dame staff found that player in Frisco (Texas) Reedy wide receiver Kaleb Smith, who was previously committed to Texas Tech. The Irish were able to make that flip and secure arguably one of the most underrated pass catchers in the class.
Whether it is as a wide receiver or return man, Smith is an impressive player in space, possessing the short area quickness and explosiveness to make things happen after the catch. He is another testament to a staff evaluating and identifying talent that could fit well together. 
All three Texas pass catchers are extremely different, and that’s exactly what makes the fit so interesting. 
For the final member of a potentially dynamic four-man class, Folsom (Calif.) High School star Rico Flores Jr. was a player who was previously on the board when Stuckey came to Notre Dame. A bit of a common theme, Flores has been fully transparent that there wasn’t a ton of interest from his side when the previous staff was still in charge. 
It is no exaggeration to say that if a coaching change didn’t happen that the California star would not be a part of the class right now. Just ask Flores for that confirmation. 
Flores is an intriguing pass catcher who is one of the more polished wide receivers in the 2023 recruiting class. He has an outside and in profile that could potentially provide snaps out wide or in the slot in a pinch. 
The Folsom star is an impressive ball tracker who attacks the ball well working vertically. He is also a mature route runner who can create some instant separation in the short to intermediate levels of the field. Flores provides an overall tremendous compliment to the other receivers in the class potentially. 
It’s hard to poke many holes in the 2023 wide receiver group as a whole. In a world ruled by NIL, Stuckey was able to identify good fits into the class and close quickly.
With the position having opportunities out there heading into next season, the class should have an opportunity to fight for immediate playing time. 
In a world where the transfer portal is such a prevalent commodity to roster construction, recruiting has transcended way past just high schoolers. With depth inherited death issues still on the roster from the previous staff, Notre Dame was also in the market for a transfer portal addition to the wide receiver room. 
Quietly the staff also pulled in a really nice addition on Wednesday amidst the signing day madness. Former Virginia Tech pass catcher Kaleb Smith went public that he had committed to finish out his college career as a part of the Irish program. 
In 11 games in 2022 for the Hokies, Smith led the team with 37 receptions for 674 yards and three touchdowns for a struggling passing attack.
At 6-2 and 222 pounds, Smith brings an obvious big body to the table and he uses every bit of that frame to win above the rim and extend for the football. He has premier body control to contort his body in a variety of ways and finish through contact. 
Smith also has some sneaky vertical speed, evident by 18.2 yards per reception last season. There is a clear projection as a productive outside receiver if Smith makes a clean transition from Blacksburg. 
The even better part about the fit is that Notre Dame isn’t hurting for wide receiver talent. It isn’t a necessity for Smith to come in and be “the guy.” 
If he does, that’s great. If he just becomes good depth, that’s also great. With his size, experience and special teams ability, he is an outstanding addition to the Notre Dame roster. 
Irish Breakdown Fans be sure to get your Notre Dame tickets from SI Tickets HERE
Be sure to check out the Irish Breakdown message board, the Champions Lounge
Irish Breakdown Content
Notre Dame 2022 RosterNotre Dame 2022 Schedule
Notre Dame 2023 Class Big BoardNotre Dame 2023 Commits Board - OffenseNotre Dame 2023 Commits Board - Defense
Notre Dame 2023 Scholarship OffersNotre Dame 2024 Scholarship OffersRanking The 2022 Signees - OffenseRanking The 2022 Signees - Defense
———————
Become a premium Irish Breakdown member, which grants you access to all of our premium content and our premium message board! Click on the link below for more.
BECOME A MEMBER
Be sure to stay locked into Irish Breakdown all the time!
Join the Irish Breakdown community!Subscribe to the Irish Breakdown YouTube channelSubscribe to the Irish Breakdown podcast on iTunesFollow me on Twitter: @RiseNDraftLike and follow Irish Breakdown on Facebook
Sign up for the FREE Irish Breakdown daily newsletter","Sports Illustrated Notre Dame Fighting Irish News, Analysis and More","Braylon james, Notre dame football, Rico flores jr., Jaden greathouse, Recruiting, Chansi stuckey, Kaleb smith, Notre dame, Football",Ryan roberts,"Fri, 23 Dec 2022 10:00:00 GMT","Under WR Coach Chansi Stuckey, Notre Dame answered a lot of wide receiver questions on National Signing Day",https://www.si.com/.image/c_limit%2Ccs_srgb%2Ch_1200%2Cq_auto:good%2Cw_1200/MTk0MTUyODU3Mzc1NjE0NDY5/notre-dame-wide-receivers.png
https://www.si.com/college/notredame/football/notre-dame-football-braden-fiske-is-a-must-get-in-the-transfer-portal,Braden Fiske Is A Must Get For Notre Dame,"Notre Dame is battling for Western Michigan transfer Braden Fiske, and landing him is a key to the Irish having a championship caliber defense in 2023
Notre Dame has not been a major transfer portal player but when they do it is for a major need, and that is true looking at the 2023 season as well. Notre Dame has made Western Michigan transfer defensive tackle Braden Fiske a priority, and landing him will play a key role in the Irish building a championship defense, and missing on him would be a big loss. 
We saw how important Harvard transfer Chris Smith was to the 2022 defensive rotation, and Fiske brings a much more impactful skill set to the table. At this point the Irish are among his final three schools along with USC and Florida State.
There are a number of reasons why Fiske is so important to the Irish in 2023.
1. SIZE UPGRADE - While I think the constant emphasis on ""getting bigger"" that I see in many fan discussions gets overblown a bit I do believe that Notre Dame can and should get bigger up front. This is especially true if the Irish want to play more three-man fronts. Listed at 6-5 and 300 pounds, Fiske would certainly add a size boost to the defense. When I first saw his size my thought was, ""He could play nose tackle, right?"" Fiske, however, is no a nose tackle, he's a three-technique to five-technique type of player, which adds even more to how his size profile would benefit the defense.
Last season, defensive end Rylie Mills was the biggest starting defensive lineman at 295 pounds, the next biggest player was Jayson Ademilola at 285 pounds and next was Howard Cross, who checks in just around 270-75 pounds. If Fiske were to pick Notre Dame he would become their biggest starter, which would bump Mills down a bit and would give the Irish a much-needed boost in size.
2. IMPACT TRAITS - Fiske isn't a big space eating interior player, part of what makes him such a potentially impactful player for the Irish defense is that he's productive. Fiske has racked up 102 tackles, 20 tackles for loss and 10 sacks the last two seasons. Yes, that's playing against MAC schools, but in four games against Power 5 opponents he racked up 3.5 tackles for loss, a sack and a forced fumble. 
If you project those numbers out over a 12-game season against Notre Dame caliber competition that would result in him posting 42 tackles, 10.5 tackles for loss and 3 sacks. When you consider he'll also be surrounded by better players it projects his numbers to be better than that, but even if he were to post those numbers it would be a major jump in disruptive production. 
Notre Dame's most productive interior defender was Jayson Ademilola, who had just 29 tackles, 6 tackles for loss and 3 sacks. Next was Howard Cross III with 33 tackles, 2.5 tackles for loss and 2 sacks.
Over the last two seasons Fiske has racked up 102 tackles, 20 tackles for loss and 10 sacks. No one on the Notre Dame defense came close to that over the same stretch.
3. VERSATILITY - Fiske can play a lot of spots in the Irish defense, and his ability to be disruptive is present at all of them. In a four-down front he projects best as a three-technique, which is the spot that was manned by Ademilola, whose Notre Dame career will be over after the bowl game. Landing Fiske would give the Irish a bigger, more disruptive player at that position in the base looks, which would be significant.
Fiske was forced to play big end for the Broncos when they faced Michigan State, and he stepped up and played well. He had 5 tackles, a tackle for loss and a forced fumble in that contest. While that isn't his best position, he could certainly play there in a pinch in the four-down looks.
Notre Dame didn't run much three-down this year for a number of reasons, but I do believe the staff would like to do it more, and Fiske would allow that to become a more impactful look. In a three-man look he would give the Irish a pair of 295+ pound ends, along with Mills, that can be physical against the run and disruptive against the pass game. Fiske and Mills could form quite the potent duo in this kind of look.
With players like Jordan Botelho, Junior Tuihalamaka and Josh Burnham battling for spots at the Vyper, a 3-3 look could be far more advantageous than it was the last two seasons with Isaiah Foskey at the position. Foskey is a pure defensive end, but all three of the aforementioned players are converted linebackers, so having them at the Vyper with Fiske and Mills on the field together means Notre Dame could do a lot more of the looks you want in a defense that moves between a 4-2-5 and a 3-3-5 without having to substitute personnel.
4. DEPTH UPGRADE - Notre Dame will likely be quite young behind the starters next season, so being able to add a veteran inside allows the younger players to have a bit more time to develop before they become ""the guys"" in the Irish defense.
5. LEADERSHIP - The future of the interior of the defensive line is likely current players like Gabriel Rubio, Jason Onye, Tyson Ford and Donovan Hinish, as well as freshmen Devan Houstan and possibly Brenan Vernon and Boubacar Traore. As stated above, all could use one more year before being forced into roles where they have to be ""the guy"" inside. Fiske will be a 6th year senior in 2023 and he was a captain for the Broncos. 
Having a player with his talent and experience would prove incredibly beneficial to those talented younger players. He not only gives them more time to grow and develop, he has the leadership and experience to also help make them better players. That means if Fiske comes to Notre Dame and embraces this role he could have an impact for the Irish that goes beyond the one season he would be in uniform.
That could be huge for Notre Dame.
Notre Dame director of recruiting Ryan Roberts did a quick film breakdown of Fiske as well.
A scheme versatile defensive lineman for Western Michigan over the last few seasons, Fiske has been asked to do everything from playing nose tackle and working all the way out to a five technique. This past year, he was even asked to play more of a nine technique as a standup rusher against Michigan State with injuries to other defensive ends on the roster, and did it with high success. That alignment versatility is a rare component that you do not see too often. 
Originally coming to the Broncos program as a slender 240-pound defensive lineman, Fiske has now grown to play between 290 and 300 pounds pretty consistently. Fiske has added good weight to his frame and his power profile has been a big beneficiary. He is able to play well inside his frame and generate a ton of power in some very tight windows. This allows him to anchor down soundly against double teams and work through contact.
Fiske’s best projection is in a one gap penetration style defense that allows him to shoot gaps and create penetration. He has a good combination of short area quickness and first step explosiveness to put opposing offensive lineman in some very difficult positions with a tough time to recover. For a player who fits best inside ideally, Fiske is surprisingly solid in space. This allows him to play outside his frame and finish a variety of plays. 
Irish Breakdown Fans be sure to get your Notre Dame tickets from SI Tickets HERE
Be sure to check out the Irish Breakdown message board, the Champions Lounge
Irish Breakdown Content
Notre Dame 2022 Roster Notre Dame 2022 Schedule
Notre Dame 2023 Class Big Board Notre Dame 2023 Commits Board - Offense Notre Dame 2023 Commits Board - Defense
Notre Dame 2023 Scholarship Offers Notre Dame 2024 Scholarship Offers  Ranking The 2022 Signees - Offense Ranking The 2022 Signees - Defense
———————
Become a premium Irish Breakdown member, which grants you access to all of our premium content and our premium message board! Click on the link below for more.
BECOME A MEMBER
Be sure to stay locked into Irish Breakdown all the time!
Join the Irish Breakdown community! Subscribe to the Irish Breakdown YouTube channel Subscribe to the Irish Breakdown podcast on iTunes Follow me on Twitter: @CoachD178 Follow me on Gettr: @IrishBreakdown Like and follow Irish Breakdown on Facebook
Sign up for the FREE Irish Breakdown daily newsletter","Sports Illustrated Notre Dame Fighting Irish News, Analysis and More","Gabriel rubio, Brenan vernon, Jayson ademilola, Notre dame football, Braden fiske, Jason onye, Notre dame, Football, Howard cross iii, Tyson ford, Boubacar traore, Devan houstan, Donovan hinish",Bryan driskell,"Fri, 23 Dec 2022 02:05:11 GMT","Notre Dame is battling for Western Michigan transfer Braden Fiske, and landing him is a key to the Irish having a championship caliber defense in 2023",https://www.si.com/.image/c_limit%2Ccs_srgb%2Ch_1200%2Cq_auto:good%2Cw_1200/MTk0MjIyMDA5NTcwODI5ODI5/braden-fiske.png
