url,headline,body,source_name,categories,authors,datepub,description,image
https://www.si.com/nfl/saints/editorial-opinion/saint-pass-defense-browns-passing-attack,Saints Defense Looks to Pounce on Erratic Browns Passing Attack,"New Orleans will need to shut down Cleveland's running game, but must also stop the Browns passing attack from getting any momentum to gift wrap a Christmas Eve win.
The New Orleans Saints trek north to take on the Cleveland Browns in a Saturday afternoon game on Christmas Eve. New Orleans (5-9) needs a win to maintain their slim playoff chances, as do the 6-8 Browns.
Weather is expected to affect both offenses on Saturday. A winter storm forecasts potential heavy snowfall, freezing temperatures, and high winds starting Friday into Christmas Day. It's the kind of weather that would seem to favor the defenses but might be perfect for the Browns' offensive style. 
New Orleans comes into this game, allowing 327.6 yards per game defensively to rank 11th in the NFL. Those are solid numbers, but the Saints have forced only ten turnovers, the fewest in the league, and have been prone to breakdowns in crucial moments. Even more concerning has been the team's struggles against the run that has plagued them all year. 
The Saints take on a Browns squad that added a big-time quarterback in Deshaun Watson this offseason. Watson is entering his fourth game after an 11-game suspension for an offense that ranks eighth in total yardage with 362.6 per outing. Most of that is thanks to a physical fifth-ranked running game. 
If New Orleans manages to slow Cleveland's running attack, will the Browns be able to win the game through the air?
New Orleans has allowed only one 300-yard passer and held eight opponents under 200 yards through the air this season. However, key breakdowns cost them late losses to Minnesota, Cincinnati, and Tampa Bay. 
The Saints' pass rush started slowly in 2022, but since Week 3 have been among the league leaders in sacks and pressures. Veteran DE Cam Jordan is having another strong year. Jordan has 5.5 sacks and 13 pressures in a down year by his standards, but still creates consistent disruption along the edge. 
New Orleans has one of the league's most talented defensive end rotations. Marcus Davenport complements Jordan well. He has just a half sack, but his 14 pressures lead the team. Carl Granderson, Payton Turner, and Tanoh Kpassagnon provide terrific depth and have combined for 7 sacks and 14 QB hits. 
The defensive tackle has been a weak area for the team most of the year, but they've made some noise in recent weeks. David Onyemata, Shy Tuttle, Kentavius Street, and Malcolm Roach have contributed little most of the year. However, the majority of their combined 9.5 sacks and 21 QB hits have occurred over the last month. 
New Orleans linebackers have been a model of consistency all season.  Unfortunately, LB Pete Werner will miss his fifth of six games, this time because of a hamstring injury.  However, Kaden Elliss has played like a star in his absence. 
Elliss, a fourth-year pro, has 5.5 sacks and 64 tackles this season.  Both numbers are career bests.  Forty-nine of those stops and 4.5 sacks have come in the last six games since Werner has been hurt.  A physical downhill player, Elliss has also shown marked improvement in his coverage skills, which was thought to be a weakness. 
The most important cog in the defense remains LB Demario Davis, who was just named to the NFC Pro Bowl roster.  Davis has a team-high 6.5 sacks and 89 tackles, including nine for loss and an interception along with five passes broken up.  He's an elite run defender and devastating blitzer, but also has the ability to cover backs and tight ends all over the field.
Star CB Marshon Lattimore looks closer to returning from abdominal injuries, but will likely miss his 10th straight game this week in the cold weather.  Rookie CB Alontae Taylor, a second-round choice, is emerging as a star in Lattimore's absence.
Despite playing in just eight games, Taylor leads the team with 10 passes broken up.  He's taken on Lattimore's role of often shadowing an opponent’s top receiver and gets targeted frequently, but is giving up only 49.2% completion percentage in man coverage. 
Fellow corner Paulson Adebo has struggled a bit in his second season.  Adebo has dealt with injuries and a slump.  He's broken up six throws, but has allowed over 72% completion percentage when targeted.  Still, Adebo is a capable corner with high upside.  Veteran Bradley Roby is an above average third corner with starting experience who handles slot duties. 
Safety has been the much bigger disappointment.  Tyrann Mathieu has two of the defense's three interceptions, but has been a liability because of poor coverage support and awful tackling.
Marcus Maye has had a slightly better season, but has been in and out with injuries and may miss Saturday's contest with a shoulder issue.  P.J. Williams (knee) could also be a game-time decision, making this position even more vulnerable. 
Watson's actions off the field are reprehensible, but on the field he's a rare talent.  He's been a little slow to get into a rhythm after almost two years of inactivity.  In three games, Watson has completed 61% of his throws with two touchdowns and two interceptions, but has thrown for less than 170 yards twice. 
Cleveland's top target is reliable veteran WR Amari Cooper, who has 67 catches for 932 yards and 7 touchdowns.  Cooper is a terrific route runner who has six 100-yard outings and four more of over 70.
Third-year WR Donovan Peoples-Jones has blossomed into an adequate number two receiver.  He has 57 receptions for 782 yards and tests defenses with a combination of physical play and downfield speed.  Rookie third-round pick David Bell, who has 23 catches for 196 yards, has also flashed solid potential. 
David Njoku is one of the league's most athletic tight ends.  Njoku, who has 51 catches for 551 yards, tests defenses with his downfield speed and is an outstanding open field runner.  Third-year TE Harrison Bryant is a bit undersized for the position, but has been a solid receiver with 27 catches for 200 yards.
The Browns have a terrific duo of running backs in Nick Chubb and Kareem Hunt.  Chubb has carried the rushing load, but both backs are lethal weapons on swing passes in the open field.  They've combined for 65 catches and 354 yards. 
Backup QB Jacoby Brissett averaged 237 yards passing with 12 touchdowns and 6 interceptions during Watson's 11-game suspension.  The Browns still bring Brissett in for some snaps.  It's usually as a runner, but he provides a threat to defenses as a thrower. 
Cleveland has a physical offensive line that bullies opponents in the trenches.  It's built for their run-based scheme, but they're also big-bodied pass protectors and have had trouble with speed rushers. 
New Orleans has the athletic pass rushers to give Cleveland pass protection problems. However, potentially bad footing could prevent the Saints from lining their ends wide to spread the Browns protection and open up chances for inside blitzes.
Weather and field conditions could force both teams to limit their passing game. That plays into Cleveland's strategy of usually relying on the run. It also tests a New Orleans run defense that has struggled most of the year. 
The Saints prefer to play a lot of man coverage. High winds and especially field conditions could force them to more short zones. If New Orleans can shut down the Browns on the ground, a major key to the game, then their ability to tackle short passes and minimize gains would bottle up Cleveland's offense and turn the game into a field position battle. 
Facing a winter storm and dealing with an offense even more limited by several injuries, the onus will be on the Saints defense to gift wrap a Christmas Eve victory. ","Sports Illustrated New Orleans Saints News, Analysis and More","New orleans saints, Marcus davenport, Jacoby brissett, Deshaun watson, Cameron jordan, David njoku, Alontae taylor, Amari cooper, Saints news, Donovan peoples-jones, Demario davis, David onyemata, New orleans saints news, Kaden elliss, Tyrann mathieu, Paulso adebo, Cleveland browns, Editorial / opinion",Bob rose,"Fri, 23 Dec 2022 14:30:37 GMT","New Orleans will need to shut down Cleveland's running game, but must also stop the Browns passing attack from getting any momentum to gift wrap a Christmas Eve win.",https://www.si.com/.image/c_limit%2Ccs_srgb%2Cfl_progressive%2Ch_1200%2Cq_auto:good%2Cw_1200/MTk0NjQ3ODIzOTAyMzE5Nzc4/usatsi_11261473_168388561_lowres.jpg
https://www.si.com/nfl/saints/news/saints-jarvis-landry-ir-kirk-merritt-signed,"Saints Place Jarvis Landry on Injured Reserve, Sign Kirk Merritt to Active Roster","Jarvis Landry is heading to injured reserve, effectively ending his Saints season. Kirk Merritt has been signed from the practice squad in a corresponding move.
The Saints are placing Jarvis Landry on injured reserve Thursday. Kirk Merritt is being signed to the team's active roster from the practice squad, according to his agent Mike McCartney.
It's been a tough season for Landry, as he'll finish out with just 272 yards and a touchdown on 25 receptions in his 9 games played in 2022. Landry battled back from an ankle injury that he suffered against the Panthers early in the season, suffered a setback, and then returned to action. He was ruled out for Week 16's matchup against the Browns on the team's final injury report due to an ankle injury.
Landry, who turned 30 at the end of November, is set to become an unrestricted free agent in March.","Sports Illustrated New Orleans Saints News, Analysis and More","Nfl, Saints injury update, Jarvis landry, Saints, Saints news, News, New orleans saints, New orleans saints news, Kirk merritt, Nfl week 16, New orleans saints injuries",John hendrix,"Thu, 22 Dec 2022 21:00:17 GMT","Jarvis Landry is heading to injured reserve, effectively ending his Saints season. Kirk Merritt has been signed from the practice squad in a corresponding move.",https://www.si.com/.image/c_limit%2Ccs_srgb%2Cfl_progressive%2Ch_1200%2Cq_auto:good%2Cw_1200/MTkzNzc1MDk1OTQzMDEzODcy/usatsi_19427420_168388561_lowres.jpg
https://www.si.com/nfl/saints/news/saints-final-injury-report-week-16,"Saints Injury Roundup: Olave, Landry, Werner Among Those Ruled Out","The Saints have ruled out four of their players ahead of Saturday's game against the Browns, which include two of their main weapons at wide receiver.
The Saints put out their final injury report of the week ahead of Saturday's matchup against the Browns. Four players have been ruled out for Week 16, which include two of the team's starting wide receivers. Here's how things look against Cleveland.
OUT: Chris Olave (hamstring), Jarvis Landry (ankle), Dwayne Washington (illness), Pete Werner (hamstring)
QUESTIONABLE: Marshon Lattimore (abdomen), Marcus Maye (shoulder), Adam Trautman (ankle), P.J. Williams (knee), Andrus Peat (illness)
Among those not spotted at practice Thursday included Landry, Olave, Werner, Washington, and Peat. Jarvis Landry is going on injured reserve, effectively ending his season. Dennis Allen said after practice that Washington is dealing with cluster headaches, something that could take 3-5 weeks to recover from. 
All signs are pointing to Marshon Lattimore returning and starting for the Saints, but Dennis Allen said they'll make a decision on him and Marcus Maye tomorrow. Calvin Throckmorton likely slides in at right guard in place of Cesar Ruiz, who got hurt on the final play of the game against the Falcons and is on injured reserve. Should Peat be unable to play, then keep an eye on veteran Josh Andrews. ","Sports Illustrated New Orleans Saints News, Analysis and More","New orleans saints, Pete werner, News, Andrus peat, Jarvis landry, Chris olave, Nfl week 16, Dwayne washington, New orleans saints news, Saints news, New orleans saints injury report, Saints injury report, Saints, Nfl",John hendrix,"Thu, 22 Dec 2022 20:46:02 GMT","The Saints have ruled out four of their players ahead of Saturday's game against the Browns, which include two of their main weapons at wide receiver.",https://www.si.com/.image/c_limit%2Ccs_srgb%2Cfl_progressive%2Ch_1200%2Cq_auto:good%2Cw_1200/MTk0MTAwNDcwODU0MTk4Nzg5/chris-olave-and-landry.jpg
https://www.si.com/nfl/saints/editorial-opinion/saints-browns-game-preview-week-16,Saints vs. Browns: What to Watch For,"Both the Saints and Browns need to produce a win on Saturday, and are hoping for an early Christmas gift of cheer in Week 16. However, it will come down to who executes the best.
The Saints (5-9) and Browns (6-8) meet at FirstEnergy Stadium on Saturday as part of a very full day of NFL Week 16 games before Christmas. Both teams are trying to keep their playoff hopes alive, with them both being 12th in their respective conference. Here's some things we're paying close attention to leading up to the game.
THE WEATHER: It's going to be a dominant storyline going into the game, and for good reason. There's a Winter Storm warning in the area overnight, which is why the team will be leaving Thursday after practice. Snow, wind, and extremely low temperatures will be featured in this game. The wind might be the most significant when it comes to throws and kicks, and naturally someone like Andy Dalton is very familiar with the Ohio cold weather. However, he's not the only one.
THE GUARD PLAN: Calvin Throckmorton looks to start in place of Cesar Ruiz, who landed on injured reserve this week due to a Lisfranc injury he suffered late in the game against the Falcons. The Saints could also use a rotation like they have before with rookie Lewis Kidd, but either way it's a big loss for the New Orleans offense, who will simply have to find a way to execute without Ruiz. This looks to be a game where it'll be won in the trenches, and Baltimore put up nearly 200 rushing yards on the Browns last week, but still lost.
Nov 7, 2022; New Orleans, Louisiana, USA; New Orleans Saints cornerback Alontae Taylor (27) breaks up a pass intended for Baltimore Ravens wide receiver Demarcus Robinson (10) during the first half at Caesars Superdome. Mandatory Credit: Stephen Lew-USA TODAY Sports
CORNER LOOKS: Marshon Lattimore looks like he's been a bit more active at practice, which might be a good sign of him returning to the field. It's obviously been a disappointing season for the team's top corner, who got hurt on a fluke play that he shouldn't have been guarding against in the first place. The interesting part is if Lattimore does go, who starts on the other side? Alontae Taylor has been playing excellent, and he's been someone that can't be kept off the field. However, Paulson Adebo has also played well, very similar to the player we saw in training camp. As Dennis Allen said on Wednesday during his conference call with the media, it's a good problem to have.
RECEIVER AVAILABILITY: Jarvis Landry (ankle) was a recent addition to the injury report, and rookie Chris Olave (hamstring) hasn't practiced the first two days. Of course, it goes without saying that Tuesday's report was an estimated one, but the first look at the team saw the team without two of their top receiving threats. Thursday is a huge day for both, as well as Pete Werner, who has been out with a hamstring injury after making his return against the Falcons. ","Sports Illustrated New Orleans Saints News, Analysis and More","Marshon lattimore, Saints news, Lewis kidd, Nfl, Andy dalton, Saints, New orleans saints news, Paulson adebo, Nfl week 16, Calvin throckmorton, New orleans saints, Jarvis landry, Alontae taylor, Editorial / opinion, Chris olave, Pete werner",John hendrix,"Thu, 22 Dec 2022 15:15:00 GMT","Both the Saints and Browns need to produce a win on Saturday, and are hoping for an early Christmas gift of cheer in Week 16. However, it will come down to who executes the best.",https://www.si.com/.image/c_limit%2Ccs_srgb%2Cfl_progressive%2Ch_1200%2Cq_auto:good%2Cw_1200/MTk0NjAzODMxNjI2MDQ5MDQ4/usatsi_19647022_168388561_lowres.jpg
https://www.si.com/nfl/saints/news/saints-demario-davis-nfl-pro-bowl,Saints LB Demario Davis Among Pro Bowl Honorees,"Elite New Orleans LB Demario Davis earns a much-deserved honor on the NFC Pro Bowl team.
NFL Pro Bowl rosters were announced on Wednesday night.  The New Orleans Saints have one player on the 2023 Pro Bowl roster.  Linebacker Demario Davis earned the first Pro Bowl of his 11-year career.  Davis, who earned 1st Team All-Pro honors in 2019, had been snubbed several times in Pro Bowl voting. 
The 33-year-old Davis has been with the Saints for five years after spending five with the New York Jets and one with the Cleveland Browns.  He's one tackle away from his 10th consecutive season of at least 90 tackles and is closing in on his sixth straight year of at least 100 stops.
Davis leads the Saints with 89 tackles so far, including nine for loss.  He also leads the team with a career-high 6.5 sacks.  Davis also has 10 pressures, along with one interception and five passes broken up while allowing 62% completion percentage in coverage. 
A do-it-all defender, Davis is one of the league's best run defenders.  He possesses a rare combination of instincts, awareness, and athleticism.  Davis disrupts offenses with his blitzing ability, coverage skills, and his ferocious pursuit of the ball carrier. 
Former Saints DE Trey Hendrickson, now with the Bengals, was voted onto the AFC Pro Bowl roster.  Hendrickson played for the Saints from 2017 to 2020 as a third-round choice from Florida Atlantic.  He left New Orleans as a free agent, signing with Cincinnati and earning his first career Pro Bowl bid last season.  In 2022, Hendrickson has six sacks and 33 pressures.
The Pro Bowl will be played on February 5 in Las Vegas, it's second straight year in that venue.  This season, it will be a flag football game between the AFC and NFC that ends a week of skills competition between players from the two conferences. ","Sports Illustrated New Orleans Saints News, Analysis and More","New orleans saints, Nfl pro bowl, Saints news, Demario davis, New orleans saints news, News, Trey hendrickson, Pro bowl honors",Bob rose,"Thu, 22 Dec 2022 13:58:05 GMT",Elite New Orleans LB Demario Davis earns a much-deserved honor on the NFC Pro Bowl team.,https://www.si.com/.image/c_limit%2Ccs_srgb%2Cfl_progressive%2Ch_1200%2Cq_auto:good%2Cw_1200/MTk0NjI0NDA4Mjc3NDkzMjcy/usatsi_19204790_168388561_lowres.jpg
https://www.si.com/nfl/saints/podcasts/the-bayou-blitz-podcast-saints-nfc-south-hopes-still-alive-beat-falcons,"The Bayou Blitz Podcast: Saints NFC South Hopes Still alive, Beat Falcons","Saints News Network reporters and Bayou Blitz podcast co-hosts: Bob Rose and Brendan Boylan discuss the New Orleans Saints battle against the Atlanta Falcons. The duo also preview the Black and Gold's matchup in Cleveland.
Saints News Network reporters and Bayou Blitz podcast co-hosts: Bob Rose and Brendan Boylan discuss the New Orleans Saints battle against the Atlanta Falcons. The duo also preview the Black and Gold's matchup in Cleveland.
CLICK HERE to join the Bayou Blitz Facebook Group
Follow the podcast on Twitter and Instagram: @BayouBlitzPod
Follow Our Hosts on Twitter: Bob Rose: @Bobbyr2613 & Brendan Boylan: @Btboylan
Be sure to subscribe to the Bayou Blitz's weekly live show airing Wednesday nights at 9pm est on Facebook, Twitter, and Youtube.
Also, keep up with the latest news on Saints game day with The Bayou Blitz Podcast's Pre-Game and Halftime show, streaming live for each regular season game the Black and Gold play this season.","Sports Illustrated New Orleans Saints News, Analysis and More","Sports illustrated saints news, Saints news and updates, Podcasts, Bayou blitz podcast, Saints news video, New orleans saints news, Saints news network, Saints news, Podcast, New orelans saints news, New orleans saints podcast, Saints podcasts",Brendan boylan,"Thu, 22 Dec 2022 02:05:00 GMT",Saints News Network reporters and Bayou Blitz podcast co-hosts: Bob Rose and Brendan Boylan discuss the New Orleans Saints battle against the Atlanta Falcons. The duo also preview the Black and Gold's matchup in Cleveland.,https://www.si.com/.image/c_limit%2Ccs_srgb%2Cfl_progressive%2Ch_1200%2Cq_auto:good%2Cw_1200/MTk0NjEyODE0MjgxNzEyODAy/bayou-blitz-4.jpg
https://www.si.com/nfl/saints/news/saints-wednesday-injury-report-week-16,Saints Wednesday Injury Report - Week 16,"New Orleans released their first official injury report for their Week 16 game at Cleveland. Initial reports aren't good for two key players on each side of the ball.
The 5-9 New Orleans Saints play at the 6-8 Cleveland Browns in Week 16.  It'll be a short work week for both teams, with the game taking place on Saturday - Christmas Eve. 
Inclement weather, with freezing wind chills and significant snow falls, are predicted in advance of the game.  New Orleans will fly out on Thursday after practice instead of Friday because of the forecast. 
The Saints didn't practice on Tuesday, but released their first official injury report of the week after Wednesday's practice. 
Chris Olave, WR (hamstring)
Pete Werner, LB (hamstring)
Jarvis Landry, WR (ankle)
Dwayne Washington, RB (illness)
Marshon Lattimore, CB (abdomen)
Ryan Ramczyk, RT (rest)
Marcus Maye, S (shoulder)
Adam Trautman, TE (ankle)
P.J. Williams, S (knee)
Landry wasn't listed on the team’s estimated injury report on Tuesday, but sat out of Wednesday's session with an ankle that's given him problems all year.  Washington, who missed last week's game against Atlanta, remains out of action. 
Olave, the team’s leading receiver, injured his hamstring during the win over the Falcons, causing him to spend some time in the injury tent but returning to the game.  He's not missed a game this year, but early prognosis for his participation on Saturday in freezing conditions doesn't look good. 
Werner returned to the lineup last week after missing four games with an ankle injury.  He played in 74% of the defensive snaps, but injured his hamstring during the Atlanta game. 
Lattimore, who has missed nine straight games, looks like he's closer to returning to action. According to Nick Underhill of NewOrleans.Football, Lattimore was more active in today's session.  He had been a light participant for the last two games before being listed as a game-time scratch. 
Maye and Trautman were both nicked up against Atlanta and look questionable to play against Cleveland as of mid-week.  Ramczyk has seen light practice duty during the week most of the year. 
New Orleans got C Erik McCoy back after a four-game injury absence, but placed RG Cesar Ruiz (foot) on injured reserve yesterday.  The Saints also announced that they signed LB Ty Summers off the Jacksonville Jaguars practice squad.  Summers will be on the active roster against Cleveland, likely serving on special teams. 
The Browns are also dealing with some significant injuries.  Running back Nick Chubb (foot), DE Myles Garrett (illness), DE Jadeveon Clowney (concussion), and S John Johnson (thigh) didn't practice on Tuesday or Wednesday for the Browns. ","Sports Illustrated New Orleans Saints News, Analysis and More","Jarvis landry, Pete werner, Saints news, New orleans saints, News, Marshon lattimore, Chris olave, Marcus maye, Cleveland browns, New orleans saints news, Adam trautman",Bob rose,"Wed, 21 Dec 2022 22:02:53 GMT",New Orleans released their first official injury report for their Week 16 game at Cleveland. Initial reports aren't good for two key players on each side of the ball.,https://www.si.com/.image/c_limit%2Ccs_srgb%2Cfl_progressive%2Ch_1200%2Cq_auto:good%2Cw_1200/MTk0NjA4OTk5NTQ1NDQ3OTYw/usatsi_19137958_168388561_lowres.jpg
