url,headline,body,source_name,categories,authors,datepub,description,image
https://www.si.com/college/oregon/recruiting/quaack-rhode-island-transfer-ol-ajani-cornelius-commits-to-oregon-ducks,ANOTHER ONE: Ajani Cornelius Commits to Oregon,"The Ducks hit the portal to land arguably the top offensive lineman available.
Oregon is continuing to prove themselves in the early signing period. If adding two-five stars and flopping two four-star flip commitments on day one wasn’t enough to get you excited, the Ducks just added another huge name.
Former Rhode Island offensive lineman Ajani Cornelius has committed to the Oregon Ducks. He announced his commitment on the 247Sports YouTube channel.
Ranked as the No. 18 overall transfer portal player by 247Sports, Cornelius quickly became a hot name in the portal after spending the last three seasons with the Rams.
READ MORE: Oregon flips RB Jayden Limar from Notre Dame 
Cornelius is listed at 6'4"", 315 pounds and mainly plays right tackle. What makes him most impressive is how he came out of high school unranked in 2020 but quickly proved to others that he can play big-time football with his size and physical ability. He earned First Team All-CAA Football honors while starting all 11 games last season. 
Once he hit the transfer portal in at the end of November offers began to pour in for Cornelius. A day after announcing his entry Dan Lanning made the move to offer the interior lineman, making it his 17th offer in one day.
After taking visits to Oregon, Ohio State, Tennessee and Nebraska, Cornelius narrowed his list to those four schools. He joins a great group from the 2023 recruiting class that already features six offensive linemen.
The current offensive line haul consists of Iapani Laloulu (Honolulu, HI), Geroge Silva (Fullerton CA), Lipe Moala (Santa Ana, CA), Gernorris Wilson (Lakeland, FL) Bryce Boulton (Palm Desert, CA) and Texas transfer Junior Angilau (Salt Lake City, UT). 
With his experience and size, Cornelius should make for a great fit into Will Stein's new offense next season, especially with the departure of multiple veterans like T.J. Bass and Malaesala Aumavae-Laulu.
READ MORE: Matayo Uiagalelei commits to Oregon
Follow Josh on Twitter: @Josh_Parker04
Subscribe to our FREE newsletter to have the latest Oregon Ducks news sent directly to your inbox
Join the discussion on our forums HERE","Sports Illustrated Oregon Ducks News, Analysis and More","Oregon football, Ajani cornelius, Oregon ducks, Oregon football recruiting, Recruiting",Josh parker,"Wed, 21 Dec 2022 23:48:54 GMT",The Ducks hit the portal to land arguably the top offensive lineman available.,https://www.si.com/.image/c_limit%2Ccs_srgb%2Cfl_progressive%2Ch_1200%2Cq_auto:good%2Cw_1200/MTk0NTg4NjY0MjE3NDc4MzA2/ajani-cornelius-oregon-visit.jpg
https://www.si.com/college/oregon/recruiting/daylen-austin-flips-commitment-from-lsu-tigers-to-oregon-ducks,Daylen Austin Flips From LSU Tigers to Oregon Ducks,"The Ducks add another All-American cornerback to their 2023 recruiting class.
2023 Long Beach (Calif.) Poly cornerback Daylen Austin has flipped his commitment from the LSU Tigers to the Oregon Ducks.
He announced his decision on social media. 
Austin had been committed to LSU since May, but the Ducks never stopped recruiting him. They brought him out to Eugene for numerous visits since Dan Lanning was hired as the new coach and felt like the team to beat for some time despite his pledge to the Tigers.
The 6-foot-1, 180-pound defensive back went on to sign his national letter of intent with the Ducks on Wednesday afternoon as an added bonus to a phenomenal day for the Oregon staff. 
READ MORE: Matayo Uiagalelei commits to Oregon over USC and Ohio State
Oregon's newest defensive back pledge is rated a four-star (0.9495) prospect according to the 247Sports Composite. The same system ranks him the No. 109 player nationally, the No. 12 cornerback and the No. 9 player in California.
Austin is one of four players to flip his commitment to Oregon on Wednesday, as the Ducks also landed pledges from safety Peyton Bowen (Notre Dame), quarterback Austin Novosad (Baylor) and running back Jayden Limar.
This was especially welcome news for the Ducks as they saw cornerback Caleb Presley flip his commitment from Oregon to Washington on Wednesday. 
The Long Beach Poly product joins a secondary that features cornerback Cole Martin (signed), defensive back Collin Gill (signed), safety Kodi DeCambra (signed), safety Tyler Turner (signed) and Alabama transfer cornerback Khyree Jackson. As a senior Austin helped lead the Long Beach Poly Jack Rabbits to another Moore league title in addition to being named Moore League MVP.
READ MORE: Oregon flips RB Jayden Limar from Notre Dame
Follow Max on Twitter: @mtorressports
Subscribe to our FREE newsletter to have the latest Oregon Ducks news sent directly to your inbox
Join the discussion on our forums HERE","Sports Illustrated Oregon Ducks News, Analysis and More","Oregon football, Recruiting, Oregon football recruiting, Daylen austin, Lsu tigers, Oregon ducks",Max torres,"Wed, 21 Dec 2022 23:33:27 GMT",The Ducks add another All-American cornerback to their 2023 recruiting class.,https://www.si.com/.image/c_limit%2Ccs_srgb%2Cfl_progressive%2Ch_1200%2Cq_auto:good%2Cw_1200/MTkzODE1MzM5Nzg2NTc3MzQ3/daylen-austin-oregon-visit.jpg
https://www.si.com/college/oregon/recruiting/quaaack-2023-rb-jayden-limar-flips-commitment-from-notre-dame-to-oregon,QUAAACK: Oregon Flips RB Jayden Limar From Notre Dame,"The Ducks land another big commitment during the early signing period.
It's spatula season across the world of college football recruiting and Oregon just pulled off another big one.
2023 Lake Stevens (Wash.) running back Jayden Limar has flipped his commitment from the Notre Dame Fighting Irish to the Oregon Ducks.
He announced his decision on social media. 
Limar committed to Notre Dame in May from a top four that also included Arizona, Michigan and Oregon. The Ducks stayed in the picture and contact really picked up in the last month, with running backs coach Carlos Locklyn attending his state title game in Washington. 
READ MORE: Oregon flips five-star safety Peyton Bowen from Notre Dame
That was followed by an in-home visit from Locklyn in Lake Stevens last week and the coaching staff brought him out to Eugene for a visit over the weekend, which was the perfect chance to seal the deal. 
Limar's commitment is some positive news the Ducks needed after All-American quarterback Dante Moore flipped his commitment to UCLA on Monday.
Rated a four-star (0.9081) prospect by the 247Sports composite, the same system ranks Limar the No. 276 recruit nationally, the No. 17 running back and the No. 2 prospect in the state of Washington for the class of 2023.
The 5-foot-11, 190-pound ballcarrier becomes the second running back in Oregon's 2023 recruiting class, joining U.S. Army All-American Bowl selection Dante Dowdell out of Mississippi. He adds a new dynamic to an Oregon running back room that is projected to return Bucky Irving, Noah Whittington and Jordan James from the 2022 season after Sean Dollars and Byron Cardwell entered the transfer portal.
Limar rushed for over 2,000 yards and 36 touchdowns his senior season and averaged 9.1 yards per carry. His commitment is a great pairing with the 6-foot-2, 215-pound Dowdell, as he can serve as a change-of-pace option for Oregon's offense under new coordinator Will Stein.
Other big names to monitor on the recruiting trail for the Ducks include defensive lineman Ashton Porter and offensive lineman Ajani Cornelus who were both on campus in Eugene for visits this month.
READ MORE: Matayo Uiagalelei commits to Oregon
Follow Max on Twitter: @mtorressports
Subscribe to our FREE newsletter to have the latest Oregon Ducks news sent directly to your inbox
Join the discussion on our forums HERE","Sports Illustrated Oregon Ducks News, Analysis and More","Oregon football, Recruiting, Oregon ducks, Oregon football recruiting, Jayden limar",Max torres,"Wed, 21 Dec 2022 21:30:32 GMT",The Ducks land another big commitment during the early signing period.,https://www.si.com/.image/c_limit%2Ccs_srgb%2Cfl_progressive%2Ch_1200%2Cq_auto:good%2Cw_1200/MTg5NDEyNzc4NzI3OTc0MTUw/jayden-limar-oregon-visit.jpg
https://www.si.com/college/oregon/recruiting/caleb-presley-flips-commitment-from-oregon-ducks-to-washington-huskies,CB Caleb Presley Flips From Oregon to Washington,"Oregon loses one of their top recruits to the Huskies Wednesday afternoon.
2023 cornerback Caleb Presley has flipped his commitment from the Oregon Ducks to the Washington Huskies.
He announced his decision on social media.
Presley is rated a four-star recruit (0.9310) per 247Sports Composite. He's ranked No. 166 nationally, the No. 19 cornerback position and the No. 1 player in Washington. He had been committed to the Ducks since the beginning of July prior to flipping Wednesday. 
The four-star was able to visit both Washington and Oregon in back-to-back weeks in the beginning of December before making his early signing period decision. He's now the Huskies' highest-rated recruit for the 2023 class. 
He will be joining with four-star Curley Reed and three-star Leroy Bryant, as well as Diesel Gordon and Thaddeus Dixon in Washington's secondary haul for 2023.
READ MORE: Solomon Davis Commits to Oregon Ducks
Prior to Presley's decision to flip, Oregon was able to get a commitment from Long Beach (Calif.) Poly cornerback Daylen Austin, who's ranked No. 12 at his position and the No. 9 player in California.
Along with Austin the Ducks got another cornerback commitment from Alabama transfer Khyree Jackson earlier this month. They've also added four-star Cole Martin and three-star Collin Gill after signing their national letters of intent on Wednesday.
The defensive back group is one of the areas that the Ducks need to get fixed for next season as there were times of inconsistency this season. With the addition of these great players and a coaching staff ready to build from their mistakes, this could be one of the most improved position groups on the field next season. 
Follow Josh on Twitter: @Josh_Parker04
Subscribe to our FREE newsletter to have the latest Oregon Ducks news sent directly to your inbox
Join the discussion on our forums HERE","Sports Illustrated Oregon Ducks News, Analysis and More","Oregon football recruiting, Caleb presley, Oregon football, Recruiting, Oregon ducks",Josh parker,"Wed, 21 Dec 2022 21:21:44 GMT",Oregon loses one of their top recruits to the Huskies Wednesday afternoon.,https://www.si.com/.image/c_limit%2Ccs_srgb%2Cfl_progressive%2Ch_1200%2Cq_auto:good%2Cw_1200/MTk0MTQxNjMxNDA0ODQ0NzIx/caleb-presley-oregon-throne.jpg
