url,headline,body,source_name,categories,authors,datepub,description,image
https://www.si.com/nfl/seahawks/news/seattle-seahawks-tariq-woolen-pro-bowl-vote-rookie-kansas-city-chiefs,Seahawks Tariq Woolen 'Pro Bowl Goal'? CB Reveals View of 'Reward',"Seattle Seahawks rookie cornerback Tariq Woolen has been patience during his approach to a stellar season.
Seattle Seahawks rookie cornerback Tariq Woolen was named a 2022 Pro Bowler on Thursday, per a release of the All-Star rosters. It came as little surprise too, given he's been racking in votes amid a stellar season.
But was making the Pro Bowl ever a goal on his Christmas list? 
""No, not really,"" Woolen said. ""I just was gaining votes. But at the same time, whenever you do the right things ... you get rewarded. This is one of the rewards and one of the blessings that I get to reap"" 
Woolen admitted that he was focused on succeeding at little things as a defensive back before overstepping his goals. Getting too ahead of himself could've resulted in no kind of recognition. 
Instead, he took it one league-leading interception at a time. 
Woolen is currently tied with New Orleans Saints cornerback CJ Gardner-Johnson for a league-leading six interceptions. Woolen had an interception in four straight games from Weeks 3 through 6. 
The Defensive Rookie of the Year might be his to lose. But for now, he's focusing on the next task at hand.
The Seahawks (7-7) take on the Kansas City Chiefs (11-3) at Arrowhead on Christmas Eve on Saturday.  
You can follow Zach Dimmitt on Twitter at @ZachDimmitt7
Hey, 12s! Get your Seahawks Tickets from SI Tickets ... HERE!
Want the latest in breaking news and insider information on the Seahawks? Click Here to subscribe to AllSeahawks.com's Newsletter.
Follow All Seahawks.com on Twitter and Facebook
Make sure to subscribe to our daily podcast @lockedonseahawks today! Click here To Listen.
Want even more Seattle Seahawks news? Check out the SI.com team page here.","Sports Illustrated Seattle Seahawks News, Analysis and More",Seahawks news,Zach dimmitt,"Fri, 23 Dec 2022 19:30:00 GMT",Seattle Seahawks rookie cornerback Tariq Woolen has been patience during his approach to a stellar season.,https://www.si.com/.image/c_limit%2Ccs_srgb%2Cfl_progressive%2Ch_1200%2Cq_auto:good%2Cw_1200/MTk0NjM0NDA4NTcxOTcxMDk2/tariq-woolen-34.jpg
https://www.si.com/nfl/seahawks/news/seattle-seahawks-nfl-mock-draft-first-round-tcu-horned-frogs-quention-johnston,Seahawks Draft Elite WR Prospect in Latest NFL Mock,"The Seahawks are certainly not lacking for offensive weapons, but this mock draft has them adding another.
While the regular season comes to an end and the Seattle Seahawks still find themselves in the playoff hunt, looking at mock drafts for 2023 are still somewhat of a necessity. 
After all, when you own nine picks, two of which are in the first round, you're going to have a lot of different mock draft options. Which, for a playoff contending Seattle team, could further expedite its journey back to being Super Bowl contention.
In its latest mock, Yahoo Sports has the Seahawks taking a defensive playmaker and offensive playmaker with their two first round picks.
They had the Seahawks taking Georgia defensive lineman Jalen Carter with the No. 3 overall pick, which is a common pick due to Seattle's need on the defensive line. However, who they had the Seahawks taking with the current No. 15 overall pick might surprise some. 
No. 15 - Quentin Johnston (WR - TCU)
The Seahawks had a tough time finding a true No. 3 receiver and tight end Noah Fant hasn’t made the impact we thought he would. Johnston (6-foot-4, 193 pounds) would be guaranteed to change all that. His numbers don’t scream out superstar, but he’s ranked the No. 1 receiver in this draft class for a reason. Adding Johnston would give Seattle a receiver trio that no other NFL team could match.
At first glance this pick feels like a luxury pick, and it possibly is when you consider the Seahawks already have DK Metcalf and Tyler Lockett on the roster. However, a third weapon of Johnston's caliber would make the Seattle offense nearly impossible to stop.
This season Johnston recorded 903 receiving yards and five touchdowns on 53 receptions, averaging 17 yards per catch. 
Whether or not Johnston is the guy for Seattle with one of their first round picks is yet to be seen, but it is definitely fun to imagine how potent an offense would be with a receiving trio of Metcalf, Lockett and Johnston with Kenneth Walker III in the backfield. 
You can find Connor Zimmerlee on Twitter @Connorjz98
Hey, 12s! Get your Seahawks Tickets from SI Tickets ... HERE!
Want the latest in breaking news and insider information on the Seahawks? Click Here to subscribe to AllSeahawks.com's Newsletter.
Follow All Seahawks.com on Twitter and Facebook
Make sure to subscribe to our daily podcast @lockedonseahawks today! Click here To Listen.
Want even more Seattle Seahawks news? Check out the SI.com team page here.","Sports Illustrated Seattle Seahawks News, Analysis and More",Seahawks news,Connor zimmerlee,"Fri, 23 Dec 2022 18:15:52 GMT","The Seahawks are certainly not lacking for offensive weapons, but this mock draft has them adding another.",https://www.si.com/.image/c_limit%2Ccs_srgb%2Cfl_progressive%2Ch_1200%2Cq_auto:good%2Cw_1200/MTk0NjUxNDA2NDQxOTE1NTU0/usatsi_19463983.jpg
https://www.si.com/nfl/seahawks/news/seattle-seahawks-vs-kansas-city-chiefs-christmas-eve-how-to-watch-betting-odds-injury-report,"Seahawks vs. Chiefs Christmas Eve: How to Watch, Betting Odds, Injury Report","The Seattle Seahawks travel to Kansas City to take on the red-hot Chiefs on Saturday in a Christmas Eve matchup at Arrowhead Stadium.
The Kansas City Chiefs still have aspirations of being the No, 1 seed in the AFC, while the Seattle Seahawks are still trying to punch their ticket to the postseason.
A win by either team won't help them, but a loss could ruin those hopes.
Kansas City and the Buffalo Bills are tied for the AFC's best record at 11-3, but the Bills hold the tiebreaker. A loss on Saturday could put that goal out of reach.
The Seahawks are 7-7 and have lost four of their last five, and have yet to clinch an NFC playoff spot.
Seattle's biggest issue has been health ... or lack thereof. Wideout Tyler Lockett is out with an injury and running back Kenneth Walker III has been nursing an ankle, but should play on Saturday.
“Let’s just start with this game. We’ve got to play really sharp football across the board,” Seattle coach Pete Carroll said. ""We have to take advantage of all the opportunities that we get. We’ve got to catch the interceptions, we’ve got to stay onside and not give them things. We have to make them have to work and play a championship-style game.
“If we can do that,” Carroll said, “now we are getting to our capabilities.”
WHAT: Seattle Seahawks (7-7) at Kansas City Chiefs (11-3)
WHERE: GEHA Field at Arrowhead Stadium, Kansas City, Missouri (72,936)
WHEN: Saturday, Dec. 24, 2022, 10:00 a.m. PT
TELEVISION: FOX / FuboTV (try it free)
RADIO: Seattle Sports 710AM | KIRO Newsradio 97.3 FM
Betting via SI SportsBook
SPREAD: Seattle Seahawks +12.5 (-138), Kansas City Chiefs -12.5 (+115)
TOTAL: 49.5 (o -110, u -110)
MONEYLINE: Seahawks +375, Chiefs -500
Make sure to follow along with in-game updates as they happen with AllSeahawks.com.
Follow Timm Hamm on Twitter and Instagram
Hey, 12s! Get your Seahawks Tickets from SI Tickets ... HERE!
Want the latest in breaking news and insider information on the Seahawks? Click Here to subscribe to AllSeahawks.com's Newsletter.
Follow All Seahawks.com on Twitter and Facebook
Make sure to subscribe to our daily podcast @lockedonseahawks today! Click here To Listen.
Want even more Seattle Seahawks news? Check out the SI.com team page here.","Sports Illustrated Seattle Seahawks News, Analysis and More",Seahawks news,Timm hamm,"Fri, 23 Dec 2022 18:05:40 GMT",The Seattle Seahawks travel to Kansas City to take on the red-hot Chiefs on Saturday in a Christmas Eve matchup at Arrowhead Stadium.,https://www.si.com/.image/c_limit%2Ccs_srgb%2Cfl_progressive%2Ch_1200%2Cq_auto:good%2Cw_1200/MTk0NDc0NTU2MzMxNjY0OTAx/usatsi_19630229.jpg
https://www.si.com/nfl/seahawks/news/quandre-diggs-seattle-seahawks-relishes-pro-bowl-overcoming-severe-injury,Respect Earned: 'Blessed' Seahawks S Quandre Diggs Relishes Third Consecutive Pro Bowl Nod,"With just two interceptions so far, Quandre Diggs hasn't been quite as dominant in the secondary for the Seattle Seahawks as he was in 2020 and 2021. But coming off a scary injury, he has remained productive in his eighth season and as evidenced by a lack of targets as well as Pro Bowl votes, remains highly-regarded by his peers.
RENTON, Wash. - After coming up short as an alternate selection in 2018 and 2019, Quandre Diggs finally got over the proverbial Pro Bowl hump with the Seahawks in 2020, earning his first all-star selection while leading the eventual NFC West champions with five interceptions.
Even though he knew he wouldn't get to actually play in the Pro Bowl due to the COVID-19 pandemic, Diggs soaked up the special moment he felt he had earned in the previous two seasons. At that time, the former sixth-round pick out of Texas hadn't achieved a greater individual accomplishment in his NFL career and the honor was a culmination of all the hard work he had put in on the field to develop into one of the league's premier playmaking ball hawks.
Two years later, however, on the heels of Diggs earning his third consecutive Pro Bowl nod on Wednesday, that first selection no longer sits atop his personal mantle. Not after what the star safety endured and ultimately conquered this offseason recovering from a gruesome injury.
""The first one is special, the second one is cool, but when you come off something that I came off of, you guys have seen the videos, and it’s on the internet every day. People tag you in those things and you see those things, so you kind of look up and thank God that you are able to be out here and be able to play this game,"" Diggs said of his third Pro Bowl. ""I have been blessed to play every snap and go out there and compete with my guys. Who would have thought in January that I would have been able to do that? This one is definitely special and definitely means more because knowing what I went through last offseason.”
Back in January, Diggs suffered a dislocated ankle and a fractured fibula in the fourth quarter of a Week 18 win over the Cardinals while tackling running back Eno Benjamin, bringing another fantastic season in which he had intercepted a team-high five passes to a devastating conclusion. It was an emotional scene in Glendale with teammates such as cornerback D.J. Reed dropping to their knees and unable to fight back tears for their fallen comrade as he was carted off the field.
Less than 10 minutes away from becoming an unrestricted free agent for the first time, the injury could not have come at a worse time for Diggs, who was set to hit the market as one of the top defenders available. Instead, with receiver Tyler Lockett also making the trip, he flew to Green Bay and had his ankle repaired by renowned surgeon Robert Anderson, putting his status heading into free agency in a bit of limbo.
""Never take your accomplishments for granted because I keep telling people that less than a year ago, I couldn’t walk,"" Diggs remarked. ""You have to take all of that stuff and take it in stride. Sometimes you forget those things.”
Through it all, as evidenced by Lockett staying in Arizona and traveling to Green Bay for the surgery, the well-respected Diggs had a constant outpouring of support from teammates, players on other teams, and family. Dodging a bullet without any ligament damage in his ankle, he maintained a positive mindset and the Seahawks rewarded him for his outstanding play by signing him to a three-year, $40 million contract shortly after free agency opened in March.
By the time Seattle conducted mandatory minicamp in June, Diggs was close to 100 percent recovered, participating in walkthrough drills along with fellow safety Jamal Adams, who also was returning from an offseason procedure to repair a torn labrum in his left shoulder. Two months later, he reported for the start of training camp and immediately jumped back into the starting lineup with plenty of spring in his step.
As noted by coach Pete Carroll on Thursday, Diggs' fourth season with the Seahawks hasn't always been smooth sailing coming back from the injury. Unlike previous seasons where he has been a football magnet, he has missed out on several interception opportunities, including letting an errant pass by 49ers rookie Brock Purdy bounce off his chest in a 21-13 loss in Week 15. Per Pro Football Focus, he has dropped four interceptions, tied for the most among safeties, and has also missed 11 tackles in 14 starts, tied for the second-most on the team.
Leading up to a Week 8 matchup with the Giants, Diggs admitted he may have been playing a bit hesitant earlier in the season coming off the ankle injury, which contributed to a somewhat slow start by his standards both in coverage and as a tackler.
But while Carroll acknowledged Diggs has left more plays on the field than usual, he still has had a stellar campaign and his leadership in a young secondary featuring two rookie starters in budding star Tariq Woolen and Coby Bryant has been invaluable, especially with Adams lost for the season to a torn quad in Week 1. For that reason, he isn't surprised to see Diggs join Earl Thomas, Kam Chancellor, and Kenny Easley as only the fourth safety in franchise history with three or more Pro Bowl selections.
            “He’s played a really tough season. He keeps letting you know who he is by the way he knocks people around, the way he makes his plays,"" Carroll said of Diggs. ""He has had an unfortunate run of not converting a few interceptions. He should have five or six [picks] easily right now. That’s crushing to him because he’s a ballhawk. He’s an interceptor and last week, we had a great one and two that we didn’t get, but he’s had a couple of overthrows. He’s had some shots at it. He should’ve had five or six like I said, which would’ve changed everyone’s perspective on everything. He’s our guy. He’s our leader back there and we need him.”
Even with his interception numbers being down compared to the past three seasons where he ranked among league leaders, Diggs has still been a viable center fielder locking up the back of Seattle's defense. According to PFF, he has allowed the fourth-fewest receptions (10) and third-lowest completion rate (52.6) in coverage among qualified safeties with at least 330 coverage snaps. He also ranks a respectable sixth in yards allowed (135) and ninth in passer rating (71.1).
On top of those quality numbers as a pass defender, Diggs ranks fourth on the Seahawks with 64 combined tackles and has added a pair of pressures and a quarterback hit on just five blitzing opportunities.
Though all of those statistics paint a different picture in regard to Diggs' play this season, nothing may be more telling about the respect opponents have for him than the general lack of targets in his direction. As has been the case ever since he arrived via trade from Detroit midway through the 2019 season, opposing quarterbacks rarely test the seams or throw post routes against the Seahawks because of No. 6's presence and he has only been targeted 19 times total.
That league-wide respect could be seen on social media with the rush of tweets and messages from players and coaches wishing him well after he suffered his injury 11 months ago. Much to the delight of a thankful Diggs, that respect also carried over into Pro Bowl voting with his peers showing their admiration by vaulting him into the top spot at free safety for a third straight year, something he will not take for granted after all that he overcame to return to the field last spring.
“Man, it feels good. It’s always good to be honored by fans and of course by my peers and coaches. For me, that’s the most important thing, the respect around the league. I don’t really care what everybody else has to say, it’s more of what guys see me do every week. Obviously, my peers feel a certain way about me, so I’m blessed.”
Hey, 12s! Get your Seahawks Tickets from SI Tickets ... HERE!
Want the latest in breaking news and insider information on the Seahawks? Click Here to subscribe to AllSeahawks.com's Newsletter.
Follow All Seahawks.com on Twitter and Facebook
Make sure to subscribe to our daily podcast @lockedonseahawks today! Click here To Listen.
Want even more Seattle Seahawks news? Check out the SI.com team page here.","Sports Illustrated Seattle Seahawks News, Analysis and More","Seahawks news, Quandre diggs, Seattle seahawks",Corbin k. smith,"Fri, 23 Dec 2022 17:26:50 GMT","With just two interceptions so far, Quandre Diggs hasn't been quite as dominant in the secondary for the Seattle Seahawks as he was in 2020 and 2021. But coming off a scary injury, he has remained productive in his eighth season and as evidenced by a lack of targets as well as Pro Bowl votes, remains highly-regarded by his peers.",https://www.si.com/.image/c_limit%2Ccs_srgb%2Cfl_progressive%2Ch_1200%2Cq_auto:good%2Cw_1200/MTk0NjUwOTcxMzA4MDQxNzUy/usatsi_19608431.jpg
https://www.si.com/nfl/seahawks/news/seattle-seahawks-rookie-class-top-five-tariq-woolen-coby-bryant-kenneth-walker,Seahawks Dynamic Rookie Class Lands in Top Five of NFL,"Whether or not the Seahawks make the playoffs, their rookies have shown they have franchise cornerstones in place.
With three games left in the season, the Seattle Seahawks sit at 7-7 and are still in the hunt for a playoff spot, which is far from where most people thought they would be at this point. 
However, despite preseason expectations, the Seahawks have proven this was not a rebuilding season. Yes, the resurgence of quarterback Geno Smith into an MVP-caliber player has certainly been a catalyst for Seattle's success, but he is far from the sole reason. 
Rather, the fact that the Seahawks absolutely crushed the 2022 draft has gone a long way toward their playoff contention. As such, Bucky Brooks of NFL.com believes they're the No. 2 overall rookie class this season, and it's hard to argue against that.
On offense, a trio of Seahawk rookies has made a name for themselves. Charles Cross and Abraham Lucas have cemented themselves as anchors at the tackle positions for the foreseeable future, blocking for fellow rookie running back Kenneth Walker III.
Walker has served as a major catalyst for the Seahawks' offense as he's forced defenses to stay honest. He's put up Offensive Rookie of the Year numbers, rushing for 696 yards and nine touchdowns on 150 carries. 
Not to be left out, the Seahawks also have a Defensive Rookie of the Year contender in cornerback Tariq Woolen. The fifth-round pick out of UTSA has had no trouble transitioning to the NFL, recording 51 tackles and six interceptions en route to earning Pro Bowl honors. 
Woolen's fellow rookie cornerback Coby Bryant has also shown flashes this season as well with 58 total tackles and four forced fumbles. 
The Seahawks may not ultimately make the playoffs this season, but even if they don't this season has been a smashing success. They know now that their rookies are franchise cornerstones, and with plenty of picks in the 2023 draft, well, the future is bright in Seattle once again.
You can find Connor Zimmerlee on Twitter @Connorjz98
Hey, 12s! Get your Seahawks Tickets from SI Tickets ... HERE!
Want the latest in breaking news and insider information on the Seahawks? Click Here to subscribe to AllSeahawks.com's Newsletter.
Follow All Seahawks.com on Twitter and Facebook
Make sure to subscribe to our daily podcast @lockedonseahawks today! Click here To Listen.
Want even more Seattle Seahawks news? Check out the SI.com team page here.","Sports Illustrated Seattle Seahawks News, Analysis and More",Seahawks news,Connor zimmerlee,"Fri, 23 Dec 2022 01:30:23 GMT","Whether or not the Seahawks make the playoffs, their rookies have shown they have franchise cornerstones in place.",https://www.si.com/.image/c_limit%2Ccs_srgb%2Cfl_progressive%2Ch_1200%2Cq_auto:good%2Cw_1200/MTk0NjM1Mzg0ODcxNzI0MTk0/usatsi_19564308.jpg
https://www.si.com/nfl/seahawks/news/ryan-neal-al-woods-ruled-out-seattle-seahawks-kansas-city-chiefs,"Ryan Neal, Al Woods Ruled Out For Seahawks Pivotal Week 16 Matchup at Chiefs","Along with missing one of their best offensive weapons, the Seattle Seahawks will be down two key starters on defense against Kansas City's top-ranked scoring machine.
Already set to play minus star receiver Tyler Lockett as he recovers from hand surgery, the Seahawks will also be without the services of starting defensive tackle Al Woods and Ryan Neal against the Chiefs in Saturday's must-win Christmas Eve contest at Arrowhead Stadium.
Earlier this week, coach Pete Carroll wasn't sure whether Neal or Woods would be able to bounce back and play by Saturday, indicating Seattle would handle their situations day to day. Unfortunately, neither player practiced at all this week due to knee and heel injuries respectively and with less than 48 hours until kickoff, the team officially ruled both of them out on Thursday's final injury report.
Playing banged up for the past several weeks, Neal has gutted through shoulder, elbow, and knee injuries. Struggling to get through the final quarter against the 49ers last Thursday night, the Seahawks opted to shut him down this weekend with hopes he can be ready to play against the Jets in Week 17.
As for Woods, the veteran nose tackle aggravated what Carroll called an ""old"" Achilles injury in a Week 14 loss to Carolina. While he was listed as questionable to face San Francisco, he ultimately didn't dress and will now miss his second consecutive game.
In Neal's absence, the Seahawks could turn to former first-round pick Johnathan Abram, who has played four defensive snaps in his first two games with the team since being claimed off waivers from the Packers earlier this month. Ex-Florida standout Teez Tabor also may be in consideration after logging substantial snaps as a dime defender in the past three games.
While Seattle has decent options to fill in for Neal at safety, the situation may be far more dire at defensive tackle. The team lost Bryan Mone to a season-ending ACL injury last week and placed him on injured reserve on Tuesday, leaving them with minimal depth at the nose position minus Woods.
As they did against the 49ers on Thursday, Poona Ford and Myles Adams will likely see the bulk of snaps playing nose tackle, while Shelby Harris could also see a few plays there if needed. With those three players all rotating inside, immediate snaps at the 3-tech spot may be available for former Iowa star Daviyon Nixon, who the team signed as a free agent on Wednesday.
At receiver, Seattle knew Lockett would not be available this week after having a broken bone in his left hand repaired on Monday. Carroll expressed optimism that the Pro Bowl wideout could return as quickly as next week against New York, but with him sidelined for at least one game and Marquise Goodwin listed as questionable with wrist/ankle issues, quarterback Geno Smith will likely have to lean on receivers who haven't played much this year amid frigid winter temperatures.
Among those standing to gain from Lockett and/or Goodwin's absence, seventh-round pick Dareke Young has gradually seen increased playing time on offense as the season has progressed and former Vikings first-round pick Laquon Treadwell was signed off the practice squad on Monday. Versatile veteran Penny Hart will also be active, while the Seahawks have a trio of receivers on the practice squad they can elevate for game day if needed.
In additional injury news, running backs Ken Walker III and DeeJay Dallas both received questionable designations as they continue to deal with lingering ankle injuries. Despite starting against the 49ers last week, Walker hasn't practiced for precautionary reasons as the Seahawks manage his workload, while Dallas sat out the past two games and was limited in Wednesday's practice.
In the event Walker or Dallas doesn't suit up, Seattle re-signed veteran Wayne Gallman to its practice squad and also has Darwin Thompson and Godwin Igwebuike available to elevate to the roster before Saturday's game. The team did release Tony Jones Jr. in a corresponding move to sign Nixon, leaving the team with less backfield depth.
The Seahawks may also enter Saturday's contest without tight end Noah Fant, who has been sidelined at practice this week due to a knee injury. He received a questionable designation and likely will be a game-time decision.
Hey, 12s! Get your Seahawks Tickets from SI Tickets ... HERE!
Want the latest in breaking news and insider information on the Seahawks? Click Here to subscribe to AllSeahawks.com's Newsletter.
Follow All Seahawks.com on Twitter and Facebook
Make sure to subscribe to our daily podcast @lockedonseahawks today! Click here To Listen.
Want even more Seattle Seahawks news? Check out the SI.com team page here.","Sports Illustrated Seattle Seahawks News, Analysis and More","Seahawks news, Ryan neal, Al woods, Tyler lockett, Seattle seahawks",Corbin k. smith,"Thu, 22 Dec 2022 21:58:41 GMT","Along with missing one of their best offensive weapons, the Seattle Seahawks will be down two key starters on defense against Kansas City's top-ranked scoring machine.",https://www.si.com/.image/c_limit%2Ccs_srgb%2Cfl_progressive%2Ch_1200%2Cq_auto:good%2Cw_1200/MTg0MzI4Nzc4Njk1MDU4NDU3/usatsi_16886294.jpg
