url,headline,body,source_name,categories,authors,datepub,description,image
https://www.si.com/nfl/seahawks/news/seattle-seahawks-franco-harris-steelers-dead-obit-geno-smith-pro-bowl,Geno Smith Leads 4 Seattle Seahawks To Pro Bowl Team,"Follow along with AllSeahawks.com as we keep you up to date with all firings, hirings, and breaking news in the NFL.
DEC 21 FOUR TO PRO BOWL The Seattle Seahawks will be represented in the 2023 Pro Bowl by four players, the NFL announced. Quandre Diggs and Jason Myers will be going back, and a pair of first-timers - the vet QB Geno Smith and the rookie corner Tariq Woolen - will be joining them.
DEC 21 FRANCO PASSES AWAY Franco Harris, the former Steelers all-time great who finished his Hall of Fame career with the Seahawks, has passed away at the age of 72.
Harris, the running back known in the football world for “The Immaculate Reception,'' was part of four Steelers Super Bowl winners. Harris played 13 years in the NFL – 12 with the Steelers and one with the Seahawks in 1984 before the nine-time Pro Bowler retired.
Harris' death comes on the eve of the 50th anniversary of the play that marked Pittsburgh jump to title contention NFL’s elite and just before this weekend's plan to retire his No. 32 during a ceremony at halftime of the Steelers game against the Las Vegas Raiders - the same team he victimized with the wild carom-catch for a winning TD in a playoff game against Oakland in 1972.
DEC 20 TREADWELL SIGNED
Wide receiver Laquon Treadwell has been elevated from the practice squad to the Seahawks roster three times this season, meaning a decision is due: Call him up again and he's eventually subjected to waivers. Or ...
Sign Treadwell to the active roster, which ESPN reports is now in the works on Tuesday.
Treadwell, Minnesota's first-round pick in 2016, has one catch for one yard in his three appearances this year and has helped on special teams.
DEC 15 LOCKET INJURED
During their crushing defeat to the San Francisco 49ers on Thursday night, the Seattle Seahawks may have also suffered a devastating personnel loss, with wideout Tyler Lockett being forced to leave the game with a broken index finger.
Pete Carroll updated the media on Lockett's status following the game. 
Carroll expects Lockett to miss time due to the injury. 
""I can't even fathom it,"" Carrol said. ""I can't fathom playing without Tyler.""
DEC 13 MISSING DEEBO The San Francisco 49ers are 9-4 and in the driver's seat in the NFC West as they approach Thursday's visit to Seattle. It's all feel-good ... maybe even eventually for do-it-all star Deebo Samuel.
He left Sunday's 35-7 win over the Tampa Bay Buccaneers in the second quarter with what looked like a leg injury. ... and the famously tough and talented Samuel was carted away in tears.
But now it's possible that Samuel - who has issues with his knee and ankle - may make it back sometime before the end of the season.
The 49ers have some breathing room in the division, with Seattle at 7-6 chasing. Samuel will be watching on Thursday, but as the playoffs approach? Deebo - who has caught 54 passes for 612 yards and two touchdowns this season while also rushing 41 times for 228 yards and three scores - will merit watching.
DEC 11 WILSON CONCUSSION Russell Wilson was knocked out of the game against the Chiefs with a concussion on Sunday, all part of the Broncos' 34-28 loss.
Wilson has experienced a dismal season for the 3-10 Broncos since orchestrating his way out of Seattle via a blockbuster trade.
First-year Broncos coach Nathaniel Hackett said Wilson is now entered into the concussion protocol. His status for the game next Sunday against Arizona is uncertain.
“He was fighting the whole game. I give him so much credit,” Hackett said of Wilson. “He was playing really well.”
DEC 11 WOODS OUT The Seattle Seahawks appear to be without one of their best defensive linemen for the rest of their Sunday matchup with the Carolina Panthers, with Al Woods listed as doubtful to return with a heel injury, per Seahawks Public Relations. 
The Seahawks trailed 20-14 at the time of the injury. 
DEC 10 LAQUON UP The Seattle Seahawks have made a trio of roster moves in advance of Sunday's game against the Carolina Panthers, including the elevation of receiver Laquon Treadwell from the practice squad.
With injuries to Ken Walker and DeeJay Dallas, Travis Homer, Tony Jones and elevated Godwin Igwebuike are in play at running back,
Additionally, Jon Rhattigan has been activated off the PUP list.
DEC. 6 SEAHAWKS SIGN WAYNE GALLMAN
The Seattle Seahawks reportedly added some running depth to their offense on Tuesday, signing veteran running back Wayne Gallman to the practice squad.
Gallman comes in at a position of need for the Seahawks, who are already short at the position. Not to mention that starting running back Ken Walker III is currently battling an ankle injury. 
Originally drafted by the  Giants in the fourth round of the 2017 NFL Draft out of Clemson, Gallman spent four seasons in New York rushing 338 times for 1,444 yards (4.3 yards per carry) and nine touchdowns in 43 games, with 14 starts. 
Last season, Gallman spent time on both the Atlanta Falcons and Minnesota Vikings playing in eight games and rushing 28 times 104 yards. 
He was also briefly on the Kansas City Chiefs practice squad earlier this season.
DEC. 4 JIMMY GAROPPOLO CARTED OFF In a matchup against the Miami Dolphins, San Francisco 49ers quarterback Jimmy Garoppolo was carted to the locker room with an ankle injury after their opening drive. 
Labeled as questionable to return, if Garoppolo remains out and misses significant time it will have a big impact on the NFC West race. 
For the Seahawks, who currently find themselves on the outside looking in of the playoffs, the 49ers being forced to rely on rookie quarterback Brock Purdy could be a boost that they need to win the division.
NOV 30 RUSS LOSES IT Russell Wilson has the trade he wanted and he has a $250 million contract.
What he does not have with the 3-8 Denver Broncos? The locker room.
“Russ has lost some people around that team. He has lost some people in that locker room,"" NFL Network insider Tom Pelissero reports.
It's worth noting that Pelissero isn't in the business of gossip, nor is he ""anti-Wilson.'' That makes this a real problem for Wilson - who has just eight touchdowns and five interceptions through 10 games this season - and for the Broncos, who gave up a gold mine in trade but team has now lost each of its last three games.
NOV 26 TREADWELL ELEVATED
Looking for additional wide receiver depth, the Seattle Seahawks have elevated former Jaguars and Vikings pass catcher Laquon Treadwell to the active roster. 
Last season in Jacksonville, Treadwell has 33 catches on 51 targets for 434 yards and a touchdown in 12 games, with seven starts. 
NOV 20 DK FINED Seahawks wide receiver DK Metcalf has been fined $29,785 by the NFL for ""unsportsmanlike conduct'' penalty in last week's loss to the Bucs in Germany.
Metcalf was flagged in that game for ""arguing with an official'' (if you could call it that) over an uncalled defensive pass interference penalty in the end zone.
Metcalf finished with a team high 71 receiving yards on six catches. ... and now during the team's bye has to cough up almost $30,000 for a finger-point.
NOV 9 'NEVER MORE WRONG' The At least Curt Menefee is admitting it.
“I’m not afraid to say I don’t think I’ve ever been more wrong about a team coming out of training camp than I was this Seahawks team,” Menefee told Seattle Sports’ Brock and Salk on Tuesday.
The Seahawks are 6-3 and Menefee, host of ""FOX NFL Sunday'' and the Seahawks preseason TV play-by-play announcer, said he thought they might be lucky to win six games total.
Menefee specifically mentioned coach Pete Carroll, saying ""He was excited about this team'' at camp and that maybe we all should have picked up on that. And he mentioned Geno Smith, a surprise MVP candidate.
“I’m happy for him, I genuinely am because I think it’s a great comeback story,” Menefee said of the QB.
NOVEMBER 1 SEAHAWKS WAIVE SIDNEY JONES 
The Seattle Seahawks have waived veteran cornerback Sidney Jones, after the conclusion of Tuesday's NFL Trade Deadline. 
The Seahawks had attempted to move Jones before the deadline, but were unable to do so. 
In two seasons with the Seahawks, Jones played in 19 games, starting 11, with 66 tackles, and 10 pass deflections. 
OCTOBER 25 SEAHAWKS RELEASE TWO FROM PRACTICE SQUAD
The Seattle Seahawks announced Tuesday that they have released running back Godwin Igwebuike and linebacker Christian Jones from the practice squad. 
Igwebuike emerged as an underrated depth piece at running back for the Detroit Lions. Last season, he rushed 18 times for 118 yards and a touchdown while catching seven passes for 60 yards. 
Jones appeared in three games this season after three elevations from the practice squad. 
OCTOBER 20 STAR RB HEADING TO NFC WEST
The Carolina Panthers have found a trade partner for star running back, Christian McCaffrey - the San Francisco 49ers. 
According to multiple reports, the Panthers will be sending McCaffrey to the Seahawks' NFC West rivals in exchange for multiple second-day picks. 
The Rams and Bills were also said to be in the running for McCaffrey
Just last week against the Rams, McCaffrey had 158 yards from scrimmage in 20 total touches. And for the season, the Stanford product has 670 yards from scrimmage on 118 touches, with three touchdowns, in an otherwise anemic offense. 
OCT 19 PRACTICE SQUAD MOVES The Seahawks made two practice squad moves on Wednesday. Seattle signed former WSU standout WR Easop Winston to their practice squad and released Kevin Kassis to make room for Winston.
Winston caught 137 balls for 1,624 yards and 19 touchdowns for the Cougars over 26 games and spent time with the Rams and Saints before arriving in Seattle.
OCT 18 SEATTLE SIGNING The Seahawks on Tuesday had in for a visit veteran defensive tackle Vernon Butler and provided workouts to Notre Dame QB Jack Coan,  receivers Dai'Jean Dixon, Dazz Newsome and Easop Winston (of Washington State) and have decided to sign Winston to the practice squad.
OCT 17 NFC WEST TRADE
The Arizona Cardinals have acquired wide receiver Robbie Anderson from the Carolina Panthers via trade.
Anderson, who played in Los Angeles against the Rams on Sunday, was kicked out of the game by his own head coach, Steve Wilks.
""I was honestly confused,"" Anderson said after the game. ""I wanted to be in the game. I've never had somebody yell to get out of the game. So I was honestly confused and upset by that. I should be. I don't see nobody that is a true competitor, that knows the value they bring and has true passion for the game, that will be OK with being told not to do something or being taken out of something when they didn't do nothing wrong.""
OCT 12 MARINERS/SEAHAWKS GAMEPLAN SET
The contingency plans for the Seattle Seahawks and the Arizona Cardinals' kick-off time have now officially been set. 
In the event that the Seattle Mariners American League Divisional Playoffs Series vs. the Houston Astros goes to four games, the kickoff time will be moved from 1:05 pm PT, to 2:30 PM PT, according to reports. 
Houston currently leads the series 1-0 and could sweep the five-game series by winning the next two games, negating the necessity of the time change. 
Should the Mariners win one of the next two games, the first pitch for Game 4 of their series will be at 1:07 pm PT. 
OCT 10 GAME TIME MOVED?
According to Seahawks head coach Pete Carroll, the Seattle Seahawks are in discussions to move the kickoff time of their Sunday matchup with the Arizona Cardinals, so as not to conflict with Game 4 of the Seattle Mariners MLB Divisional series against the Houston Astros. 
Carroll says Seahawks are discussing all options, should the times' conflict with one another. 
OCT 9 WALKER HOUSE CALL
In relief of his injured teammate Rashaad Penny, Seahawks rookie running back Kenneth Walker has already made a major impact in the game thus far against the Saints, breaking free for a 69-yard touchdown run to give Seattle a brief 32-31 lead in the fourth quarter.
Unfortunately for the Seahawks, the Saints responded with a long Taysom Hill touchdown run of their own on the very next drive, and moved up 39-32 after the two point conversion.
OCT 9 PENNY OUT The Seattle Seahawks are down a running back in their game against the New Orleans Saints as running back Rashaad Penny sustained a lower leg injury in the game and was carted off.
The Seattle Seahawks may be down a running back in their game against the New Orleans Saints today. Running back Rashaad Penny potentially suffered a lower leg injury in the game. He was able to make it to the sideline but had to be helped to the bench by teammates to get checked out by trainers.
Penny had eight carries for 54 yards before getting hurt and now gives way to at least in part the rookie Kenneth Walker III.
OCTOBER 7 SAINTS NAME ANDY DALTON STARTING QB VS. SEAHAWKS
The Seattle Seahawks are set to face Andy Dalton and the New Orleans Saints this weekend after starter Jameis Winston was ruled out for the second straight week with a back and hip injury.
Dalton made his Saints debut last week in London against the Minnesota Vikings. Dalton completed over 70 percent of his passes and threw for 236 yards and a touchdown in a 28-25 loss.
The Saints and Seahawks play at 10 a.m. in New Orleans on Sunday.
OCTOBER 6 ROSTER MOVES 
Seahawks defensive end L.J. Collier (elbow) missed the first four games of the season on IR but has now been designated to return to practice. … opening up a three-week window for his roster return..
Meanwhile, the Seahawks added an old pal to the practice squad, signing center Joey Hunt, and cut DB Quandre Mosely from the practice squad.
SEPTEMBER 28 SEAHAWKS PLACE HOMER ON IR
The Seattle Seahawks have placed running back Travis Homer on IR, following a rib injury he sustained on Sunday against the Falcons. 
To replace Homer, the Seahawks added cornerback Xavier Crawford to the 53-man roster. 
The Seahawks also signed running back Godwin Igwebuike and fullback Cullen Gillaspia to the practice squad.
SEPTEMBER 20 SEAHAWKS SEND CB TO PRACTICE SQUAD
Following their 27-7 blowout loss to the San Francisco 49ers on Sunday, the Seattle Seahawks have sent cornerback Xavier Crawford back to the practice squad. 
Crawford was elevated to the active roster for the matchup with the 49ers.
SEPTEMBER 13 SEAHAWKS ROOKIE RB TO MAKE DEBUT
Per Seattle Seahawks head coach Pete Carroll, rookie running back Kenneth Walker III, who missed the team's season-opening win over the Broncos on Monday Night Football this week, will make his NFL debut next Sunday against the San Francisco 49ers. 
“(Walker) is going to be out there this week,” Carroll told 710 ESPN in Seattle.
Before being selected in the second round by Seattle, Walker was a Heisman finalist last season with the Michigan State Spartans, rushing for 1,636 yards on the year.
SEPTEMBER 12 SEAHAWKS SEND ROBINSON TO IR, SIGN TWO FROM PRACTICE SQUAD
Just hours ahead of their Monday Night Football season opener, the Seahawks have made multiple transactions, sending outside linebacker Alton Robinson to injured reserve, keeping him out for at least four games. 
Robinson injured his knee in the preseason finale. To replace Robinson, Seattle elevated practice squad linebacker Tanner Muse.
The Seahawks have also ruled out deep snapper Tyler Ott with a shoulder injury, elevating Carson Tinker to take his place.
AUG 31 UPDATE
The Seahawks, along with the Dallas Cowboys, made a recent call to the New York Jets about disgruntled receiver Denzel Mims. 
How much does Seattle need more receiver help? That's a subject for debate.
How much does Seattle want to give up for Mims? Our guys at CowboysSI.com have the details on what the Cowboys - and the Seahawks - said ""no'' to.
AUGUST 30 CUTS BEGIN
9:15 AM: According to Brady Henderson, the Seahawks have informed center Dakoda Shepley he's being waived. The former CFL star joined the team as a waiver pickup last August after being released by the 49ers and appeared in all three preseason games seeing snaps behind Austin Blythe and Kyle Fuller.
 10:20 AM: Despite a strong preseason showing, per Doug Kyed of PFF and confirmed through a team source, the Seahawks will release undrafted rookie safety Scott Nelson. The former Wisconsin standout produced six tackles and allowed only one catch for seven yards on 73 defensive snaps in exhibition play and could be a priority candidate to re-sign on practice squad as insurance at the safety position.
10:45 AM: According to Henderson, due to a crowded group ahead of him, the Seahawks have informed tight end Tyler Mabry of his release. The team also cut ties with former Washington receiver Aaron Fuller.
10:47 AM: After finishing third on the team among receivers in receptions and receiving yards a year ago, the Seahawks are officially moving on from veteran wideout Freddie Swain. The 2020 sixth-round pick played his way out of a roster spot this month, struggling with drops during the preseason and falling down the depth chart during training camp behind the likes of rookie Dareke Young and Penny Hart.
11:01 AM: Per Tom Pelissero of NFL Network, the Seahawks have released linebacker Tanner Muse. The ex-Clemson safety appeared in six games last season, producing four tackles on special teams.
11:24 AM: Moving on from a former top pick, ESPN's Jeremy Fowler reports the Seahawks have informed safety Marquise Blair of his release. Coming off of two injury-shortened seasons, the fourth-year defender started training camp working at nickel cornerback before transitioning back to safety full-time and struggled with tackling throughout the preseason. Passed on the depth chart by Josh Jones, he became expendable in a crowded position group also featuring Jamal Adams, Quandre Diggs, and Ryan Neal.
8:48 AM: With Trey Lance set to take over under center, the 49ers have a potentially expensive decision awaiting them on veteran quarterback Jimmy Garoppolo. If the team releases him before Tuesday's deadline, they would save $25.5 million in cap space. But according to insider Jordan Schultz, general manager John Lynch isn't keen on the idea of Garoppolo ending up with the Seahawks, who play their division rivals in Week 2 and could have interest in upgrading at the position if he becomes available to sign. This will be a situation worth monitoring over the next 24 hours.
2:22 PM: Garoppolo won't be coming to Seattle. Per ESPN's Adam Schefter, the veteran quarterback agreed to a restructured one-year contract to stay in San Francisco that includes a no-trade clause, which surely would eliminate the possibility of being dealt to a division rival.
Garoppolo and the Niners have a new deal agreed that is worth $6.5 million in fully guaranteed base salary, a reduction of about $19 million from his previous salary.
11:05 AM: In the first announced cut, Pro Football Network's Aaron Wilson reported Seattle has waived undrafted rookie Cade Brewer for the second time in less than two weeks. The former Texas standout signed with the Seahawks after the draft and caught three passes for 17 yards in three exhibition games.
11:29 AM: Per Brady Henderson of ESPN, the Seahawks have waived cornerback Jameson Houston. Originally signed on August 10, he appeared in all three preseason games, registering five tackles.
1:16 PM: Along with confirming Houston and Brewer had been cut, the Seahawks announced cornerback Tre Brown (knee) has been transferred to the reserve/PUP list, which means he will miss at least the first four regular season games. The second-year defender missed all of training camp and continues to recover from a patellar tendon injury suffered in Week 11 last season.
In addition, Seattle waived linebacker Aaron Donkor and running back Ronnie Rivers, bringing the roster to 76 players. Donkor, who joined the team through the International Player Pathway Program in 2021, appeared in one preseason game before being sidelined by a hamstring injury, while Rivers played in the final preseason game after being signed last week.
Hey, 12s! Get your Seahawks Tickets from SI Tickets ... HERE!
Want the latest in breaking news and insider information on the Seahawks? Click Here to subscribe to AllSeahawks.com's Newsletter.
Follow All Seahawks.com on Twitter and Facebook
Make sure to subscribe to our daily podcast @lockedonseahawks today! Click here To Listen.
Want even more Seattle Seahawks news? Check out the SI.com team page here.","Sports Illustrated Seattle Seahawks News, Analysis and More","Nfl, Practice squad, Seahawks news, Godwin igwebuike, Christian jones",All seahawks staff,"Thu, 22 Dec 2022 01:29:40 GMT","Follow along with AllSeahawks.com as we keep you up to date with all firings, hirings, and breaking news in the NFL.",https://www.si.com/.image/c_limit%2Ccs_srgb%2Cfl_progressive%2Ch_1200%2Cq_auto:good%2Cw_1200/MTk0NDQ5NTMxOTczMTUwMzg1/usatsi_19073567-1.jpg
https://www.si.com/nfl/seahawks/news/daviyon-nixon-signs-seattle-seahawks-defensive-line-depth,"Seahawks Sign DT Daviyon Nixon, Bolster Defensive Line Depth","Previously starring at Iowa, Daviyon Nixon hasn't done much in two seasons with the Carolina Panthers. But the defensive line-needy Seattle Seahawks hope to unearth some of the athletic defender's untapped potential amid a playoff run.
After losing defensive tackle Bryan Mone to a season-ending knee injury last week, the Seahawks have added defensive line reinforcements for the final stretch run.
According to Field Yates of ESPN, Seattle has signed free agent defensive tackle Daviyon Nixon, who recently was waived by Carolina. In a corresponding move to make room on the 53-man roster, the team cut reserve running back Tony Jones Jr.
Turning in a stellar collegiate career at Iowa, Nixon racked up 74 tackles, 8.5 sacks, and 19 tackles for loss in two seasons with the Hawkeyes. Displaying rare athleticism for a 300-plus pound defensive tackle, he also returned an interception 71 yards for a touchdown as a junior, helping him earn First-Team All-American honors in 2020 before opting to declare for the NFL Draft.
During the pre-draft process, amid the COVID-19 pandemic, Nixon posted a 4.90-second 40-yard dash at 313 pounds. He also reportedly ran a respectable 4.70 short shuttle, exhibiting speed and quickness rarely found at his position.
Despite the impressive testing, however, Nixon surprisingly didn't hear his name called in the draft until the Panthers stopped his free fall by selecting him 158th overall in the fifth round. Struggling to find a consistent spot in the team's defensive line rotation, his rookie season ended after just seven games due to a knee injury and he finished with just nine tackles and a partial sack in limited playing time.
Fully recovered from his injury in time for training camp, Nixon produced three tackles in exhibition play and Carolina cut him during final roster cuts in September, promptly re-signing him to the practice squad once he cleared waivers. Logging only 62 defensive snaps in seven games, the organization moved on from him on December 13.
After failing to stick with the Panthers, with Mone done for the year and veteran Al Woods ailing, the Seahawks hope to unlock some of Nixon's untapped potential as a 3-tech defensive tackle in their hybrid 3-4 defense. If there's reason to believe he may be able to turn the corner with a change of scenery, Pro Football Focus did give him a 75.8 pass rushing grade as a rookie, suggesting he flashed in limited opportunities.
If Nixon can return to college form and inflict some damage penetrating gaps with his elite quickness off the snap, he could wind up being more than a late season rental for Seattle and play his way into future plans. Of course, it's also possible his lack of success in Carolina wasn't a fluke and he will have to earn a spot rotating with Shelby Harris, Poona Ford, Quinton Jefferson, L.J. Collier, and Myles Adams.
The decision to cut Jones, who was signed as a free agent in October and played in four games with the Seahawks, suggests starter Ken Walker III should be in good shape despite sitting out Tuesday's practice with a lingering ankle issue. Currently, the team has Walker, Travis Homer, and DeeJay Dallas on the 53-man roster and re-signed Wayne Gallman to the practice squad as insurance.
Hey, 12s! Get your Seahawks Tickets from SI Tickets ... HERE!
Want the latest in breaking news and insider information on the Seahawks? Click Here to subscribe to AllSeahawks.com's Newsletter.
Follow All Seahawks.com on Twitter and Facebook
Make sure to subscribe to our daily podcast @lockedonseahawks today! Click here To Listen.
Want even more Seattle Seahawks news? Check out the SI.com team page here.","Sports Illustrated Seattle Seahawks News, Analysis and More","Seahawks news, Seattle seahawks, Daviyon nixon",Corbin k. smith,"Wed, 21 Dec 2022 23:01:40 GMT","Previously starring at Iowa, Daviyon Nixon hasn't done much in two seasons with the Carolina Panthers. But the defensive line-needy Seattle Seahawks hope to unearth some of the athletic defender's untapped potential amid a playoff run.",https://www.si.com/.image/c_limit%2Ccs_srgb%2Cfl_progressive%2Ch_1200%2Cq_auto:good%2Cw_1200/MTk0NjA5OTczMTYwODQ2ODcy/usatsi_16895407.jpg
